QUERY,SEARCHVAL,BLK_NO,ROAD_NAME,BUILDING,ADDRESS,POSTAL,X,Y,LATITUDE,LONGITUDE
BENA PARK JALAN BENA,BENA PARK,1,JALAN PERNAMA,BENA PARK,1 JALAN PERNAMA BENA PARK SINGAPORE 499235,499235,43151.0130034098,37326.8604706917,1.35384154353976,103.969460065477
FRANKEL ESTATE CHEVIOT HILL,FRANKEL ESTATE,25,CHEVIOT HILL,FRANKEL ESTATE,25 CHEVIOT HILL FRANKEL ESTATE SINGAPORE 459634,459634,37598.2557436451,33103.8863045704,1.31565280808032,103.919563729076
LANDED HOUSING DEVELOPMENT BEECHWOOD GROVE,,,,,,,,,,
LANDED HOUSING DEVELOPMENT LORONG SARI,,,,,,,,,,
TEACHERS' HOUSING ESTATE IQBAL AVENUE,,,,,,,,,,
HONG HENG TERRACE THONG BEE ROAD,HONG HENG TERRACE,2,THONG BEE ROAD,HONG HENG TERRACE,2 THONG BEE ROAD HONG HENG TERRACE SINGAPORE 778991,778991,26226.7838063119,42772.416976897,1.40309299885161,103.817384761242
COUNTRYVIEW SEMBAWANG PLACE,COUNTRYVIEW,577,SEMBAWANG PLACE,COUNTRYVIEW,577 SEMBAWANG PLACE COUNTRYVIEW SINGAPORE 758423,758423,27088.1984551763,46632.5405216329,1.43800260236782,103.825125162641
SERANGOON GARDEN ESTATE HEMSLEY AVENUE,SERANGOON GARDEN ESTATE,1,HEMSLEY AVENUE,SERANGOON GARDEN ESTATE,1 HEMSLEY AVENUE SERANGOON GARDEN ESTATE SINGAPORE 557668,557668,31670.3987424336,38869.9284855351,1.36780011813342,103.866299664542
HOLLLAND GROVE PARK JALAN KEBAYA,,,,,,,,,,
LANDED HOUSING DEVELOPMENT CHAPEL ROAD,,,,,,,,,,
PONGGOL PARK PONGGOL SEVENTEENTH AVENUE,PONGGOL PARK,200,PONGGOL SEVENTEENTH AVENUE,PONGGOL PARK,200 PONGGOL SEVENTEENTH AVENUE PONGGOL PARK SINGAPORE 829646,829646,36044.5740181673,44153.517499784,1.4155820959501,103.905606111142
LANDED HOUSING DEVELOPMENT OWEN ROAD,,,,,,,,,,
KIMNAN PARK TAMAN SELAMAT,KIMNAN PARK,1,TAMAN SELAMAT,KIMNAN PARK,1 TAMAN SELAMAT KIMNAN PARK SINGAPORE 416406,416406,36960.2039227663,34180.0537205059,1.32538546890651,103.913830829936
LANDED HOUSING DEVELOPMENT SALLIM ROAD,,,,,,,,,,
LANDED HOUSING DEVELOPMENT ASTRID HILL,,,,,,,,,,
SARACA GARDENS SARACA WALK,SARACA GARDENS,1,SARACA WALK,SARACA GARDENS,1 SARACA WALK SARACA GARDENS SINGAPORE 807238,807238,31033.9265470896,40918.583033029,1.38632748719087,103.86058073002
MACPHERSON GARDEN ESTATE JALAN MESRA,,,,,,,,,,
OPERA ESTATE DIDO STREET,OPERA ESTATE,2,DIDO STREET,OPERA ESTATE,2 DIDO STREET OPERA ESTATE SINGAPORE 459463,459463,38386.2299728971,33547.2264865637,1.31966195836517,103.926644216518
EASTWOOD PARK EASTWOOD PLACE,,,,,,,,,,
KIM LIN PARK JALAN ARNAP,KIM LIN PARK,1,JALAN ARNAP,KIM LIN PARK,1 JALAN ARNAP KIM LIN PARK SINGAPORE 249307,249307,27528.6330620721,31585.6845885348,1.30192422299632,103.829083131892
SENNETT ESTATE CHEMPAKA AVENUE,SENNETT ESTATE,2,CHEMPAKA AVENUE,SENNETT ESTATE,2 CHEMPAKA AVENUE SENNETT ESTATE SINGAPORE 349609,349609,32667.7348292479,34825.8102566395,1.33122642011538,103.875260795285
SARACA GARDENS SARACA VIEW,SARACA GARDENS,2,SARACA VIEW,SARACA GARDENS,2 SARACA VIEW SARACA GARDENS SINGAPORE 807287,807287,31074.0214857403,40890.420974547,1.38607279545681,103.860941010743
BRADDELL HEIGHTS ESTATE MELROSE DRIVE,BRADDELL HEIGHTS ESTATE,1,MELROSE DRIVE,BRADDELL HEIGHTS ESTATE,1 MELROSE DRIVE BRADDELL HEIGHTS ESTATE SINGAPORE 358498,358498,31468.1955354335,36661.994121965,1.34783237365903,103.864482472679
SOUTH UNION PARK ELITE TERRACE,SOUTH UNION PARK,1,ELITE TERRACE,SOUTH UNION PARK,1 ELITE TERRACE SOUTH UNION PARK SINGAPORE 458744,458744,38204.8600980174,33084.1164077912,1.31547382078474,103.92501436288
LANDED HOUSING DEVELOPMENT LORONG 105 CHANGI,,,,,,,,,,
LANDED HOUSING DEVELOPMENT JALAN AMPANG,,,,,,,,,,
LANDED HOUSING DEVELOPMENT PULASAN ROAD,,,,,,,,,,
LANDED HOUSING DEVELOPMENT YARWOOD AVENUE,,,,,,,,,,
LANDED HOUSING DEVELOPMENT JALAN WAJEK,,,,,,,,,,
ISLAND COUNTRY VILLAS OLD UPPER THOMSON ROAD,ISLAND COUNTRY VILLAS,50,OLD UPPER THOMSON ROAD,ISLAND COUNTRY VILLAS,50 OLD UPPER THOMSON ROAD ISLAND COUNTRY VILLAS SINGAPORE 576226,576226,27258.116075201,39695.5233971085,1.3752667219996,103.826652214663
LANDED HOUSING DEVELOPMENT CARMICHAEL ROAD,,,,,,,,,,
HILLCREST PARK GREENDALE AVENUE,HILLCREST PARK,4,GREENDALE AVENUE,HILLCREST PARK,4 GREENDALE AVENUE HILLCREST PARK SINGAPORE 289500,289500,25114.9539557984,34909.1721580978,1.33198053695709,103.807394812379
SHEPHERD'S HILL ESTATE MERINO CRESCENT,SHEPHERD'S HILL ESTATE,1,MERINO CRESCENT,SHEPHERD'S HILL ESTATE,1 MERINO CRESCENT SHEPHERD'S HILL ESTATE SINGAPORE 149149,149149,25066.4537494099,30464.2869678326,1.29178256323639,103.806959431601
HILLVIEW GARDEN ESTATE JALAN REMAJA,HILLVIEW GARDEN ESTATE,2,JALAN REMAJA,HILLVIEW GARDEN ESTATE,2 JALAN REMAJA HILLVIEW GARDEN ESTATE SINGAPORE 668663,668663,19923.5880979225,37796.3731057923,1.35809039718141,103.760746706379
ENG KONG PARK ENG KONG GARDEN,ENG KONG PARK,1,ENG KONG GARDEN,ENG KONG PARK,1 ENG KONG GARDEN ENG KONG PARK SINGAPORE 599218,599218,20769.3762342976,35247.9693879131,1.33504377218342,103.768347275907
LLYN GARDENS PAYA LEBAR WALK,LLYN GARDENS,1,PAYA LEBAR WALK,LLYN GARDENS,1 PAYA LEBAR WALK LLYN GARDENS SINGAPORE 535926,535926,33257.2052044692,36759.8253908958,1.34871686428942,103.880557851137
LANDED HOUSING DEVELOPMENT HARVEY AVENUE,,,,,,,,,,
GOLDEN HILL ESTATE LI HWAN TERRACE,GOLDEN HILL ESTATE,1,LI HWAN TERRACE,GOLDEN HILL ESTATE,1 LI HWAN TERRACE GOLDEN HILL ESTATE SINGAPORE 556930,556930,31572.8560787272,37584.0690488741,1.35617127763341,103.86542302214
LANDED HOUSING DEVELOPMENT DUKE'S ROAD,,,,,,,,,,
MALAYSIA PARK LORONG MELAYU,MALAYSIA PARK,82,LORONG MELAYU,MALAYSIA PARK,82 LORONG MELAYU MALAYSIA PARK SINGAPORE 416995,416995,36536.4806934334,33961.1439788193,1.32340585000862,103.910023390345
HAZEL PARK TERRACE HAZEL PARK TERRACE,HAZEL PARK TERRACE,,HAZEL PARK TERRACE,NIL,HAZEL PARK TERRACE,NIL,20391.5563386935,39328.2750417435,1.37194467499453,103.764951864708
LANDED HOUSING DEVELOPMENT COVE GROVE,,,,,,,,,,
BEDOK PESARI JALAN GREJA,BEDOK PESARI,45,JALAN GREJA,BEDOK PESARI,45 JALAN GREJA BEDOK PESARI SINGAPORE 488910,488910,41499.6212020069,33994.0522690248,1.32370166928769,103.954619802562
SERANGOON GARDEN ESTATE PENSHURST PLACE,SERANGOON GARDEN ESTATE,1,PENSHURST PLACE,SERANGOON GARDEN ESTATE,1 PENSHURST PLACE SERANGOON GARDEN ESTATE SINGAPORE 556417,556417,31568.8826794326,38303.0763454344,1.36267372286237,103.865387404309
DEDAP GARDENS DEDAP PLACE,DEDAP GARDENS,1,DEDAP PLACE,DEDAP GARDENS,1 DEDAP PLACE DEDAP GARDENS SINGAPORE 809500,809500,31765.9402686656,41128.7034365311,1.38822765510706,103.86715845967
LANDED HOUSING DEVELOPMENT BROADRICK CLOSE,,,,,,,,,,
SEMBAWANG STRAITS ESTATE JALAN KERAYONG,SEMBAWANG STRAITS ESTATE,1,JALAN KERAYONG,SEMBAWANG STRAITS ESTATE,1 JALAN KERAYONG SEMBAWANG STRAITS ESTATE SINGAPORE 759299,759299,28292.5411569346,48784.9576521479,1.45746829446499,103.83594736495
CHARLTON PARK SURIN AVENUE,CHARLTON PARK,8,SURIN AVENUE,CHARLTON PARK,8 SURIN AVENUE CHARLTON PARK SINGAPORE 535583,535583,33231.5352301579,37368.3040598929,1.35421973153725,103.880327296206
FRANKEL ESTATE EAST COAST ROAD,FRANKEL ESTATE,627,EAST COAST ROAD,FRANKEL ESTATE,627 EAST COAST ROAD FRANKEL ESTATE SINGAPORE 459013,459013,37398.0047610588,32529.0870329328,1.31045459393246,103.917764200314
BEAUTY GARDEN LORONG BUANG KOK,BEAUTY GARDEN,363,LORONG BUANG KOK,BEAUTY GARDEN,363 LORONG BUANG KOK BEAUTY GARDEN SINGAPORE 547686,547686,35462.4277383061,41479.2905908283,1.39139752452014,103.900374331539
THE SPRINGSIDE SPRINGSIDE LINK,THE SPRINGSIDE,1,SPRINGSIDE LINK,THE SPRINGSIDE,1 SPRINGSIDE LINK THE SPRINGSIDE SINGAPORE 786580,786580,26493.2536610803,42958.261458613,1.40477372463278,103.819779204042
LANDED HOUSING DEVELOPMENT TOH AVENUE,,,,,,,,,,
TEACHER'S HOUSING ESTATE TU FU AVENUE,TEACHER'S HOUSING ESTATE,1,TU FU AVENUE,TEACHER'S HOUSING ESTATE,1 TU FU AVENUE TEACHER'S HOUSING ESTATE SINGAPORE 787209,787209,27541.7324703326,40186.8187499084,1.3797098272269,103.829200705622
HILLVIEW VILLAS HILLVIEW WAY,HILLVIEW VILLAS,1,HILLVIEW WAY,HILLVIEW VILLAS,1 HILLVIEW WAY HILLVIEW VILLAS SINGAPORE 669172,669172,19775.2278807256,37355.57815855,1.35410396732579,103.75941371393
LIRIA TERRACE MARIAM WALK,LIRIA TERRACE,2,MARIAM WALK,LIRIA TERRACE,2 MARIAM WALK LIRIA TERRACE SINGAPORE 507177,507177,43090.8225147417,37940.1555023286,1.35938798025313,103.968919525428
CLOVER PARK CLOVER AVENUE,CLOVER PARK,1,CLOVER AVENUE,CLOVER PARK,1 CLOVER AVENUE CLOVER PARK SINGAPORE 579290,579290,29006.3239876293,36816.410175737,1.3492290411466,103.842361031354
LANDED HOUSING DEVELOPMENT JALAN BELANGKAS,,,,,,,,,,
RAFFLES PARK ORIOLE CRESCENT,RAFFLES PARK,1,ORIOLE CRESCENT,RAFFLES PARK,1 ORIOLE CRESCENT RAFFLES PARK SINGAPORE 288595,288595,24611.4122978598,35316.5406877901,1.33566458092748,103.802870161543
LANDED HOUSING DEVELOPMENT LORONG K TELOK KURAU,,,,,,,,,,
CAPITOL PARK JALAN ADAT,CAPITOL PARK,1,JALAN ADAT,CAPITOL PARK,1 JALAN ADAT CAPITOL PARK SINGAPORE 299381,299381,26270.0936891213,34527.723434655,1.32853093786845,103.817774415961
LANDED HOUSING DEVELOPMENT COVE DRIVE,,,,,,,,,,
SOO CHOW GARDEN SOO CHOW GARDEN ROAD,SOO CHOW GARDEN ROAD,,SOO CHOW GARDEN ROAD,NIL,SOO CHOW GARDEN ROAD,NIL,27765.6230999417,37331.0500085275,1.35388358901281,103.831212851332
LANDED HOUSING DEVELOPMENT JALAN SAHABAT,,,,,,,,,,
NIM COLLECTION NIM RISE,NIM COLLECTION,1,NIM RISE,NIM COLLECTION,1 NIM RISE NIM COLLECTION SINGAPORE 804420,804420,31260.0445485609,40216.5852839388,1.37997884739248,103.862612495287
THE SHORELINE RESIDENCES II WAK HASSAN DRIVE,THE SHORELINE RESIDENCES II,60,WAK HASSAN DRIVE,THE SHORELINE RESIDENCES II,60 WAK HASSAN DRIVE THE SHORELINE RESIDENCES II SINGAPORE 757264,757264,28746.8724307818,49129.3738909978,1.46058306101276,103.840030013393
LANDED HOUSING DEVELOPMENT LORONG 16 GEYLANG,,,,,,,,,,
SOO CHOW GARDEN SOO CHOW DRIVE,SOO CHOW GARDEN,24,SOO CHOW DRIVE,SOO CHOW GARDEN,24 SOO CHOW DRIVE SOO CHOW GARDEN SINGAPORE 575537,575537,27704.5801249892,37356.0565137658,1.35410942601837,103.830664040664
EXCELSIOR GARDENS MINARET WALK,EXCELSIOR GARDENS,1,MINARET WALK,EXCELSIOR GARDENS,1 MINARET WALK EXCELSIOR GARDENS SINGAPORE 467371,467371,41253.8783479333,34088.3999351747,1.32455502204123,103.952411717228
SEA BREEZE TERRACE SEA BREEZE AVENUE,SEA BREEZE TERRACE,28,SEA BREEZE AVENUE,SEA BREEZE TERRACE,28 SEA BREEZE AVENUE SEA BREEZE TERRACE SINGAPORE 487547,487547,41307.5766265057,35504.9995363317,1.33736619558038,103.952894841053
CHOON SING GARDEN JALAN BINCHANG,CHOON SING GARDEN,101,JALAN BINCHANG,CHOON SING GARDEN,101 JALAN BINCHANG CHOON SING GARDEN SINGAPORE 578570,578570,29598.4462014409,37299.7041265033,1.35359975384999,103.847681646514
STRATTON PARK STRATTON ROAD,STRATTON PARK,1,STRATTON ROAD,STRATTON PARK,1 STRATTON ROAD STRATTON PARK SINGAPORE 806786,806786,31802.2157509867,40284.3348988611,1.38059148518834,103.867484313587
HENRY PARK GROVE AVENUE,HENRY PARK,1,GROVE AVENUE,HENRY PARK,1 GROVE AVENUE HENRY PARK SINGAPORE 279177,279177,22658.8157089343,32855.8665111531,1.31341084014093,103.78532538516
LANDED HOUSING DEVELOPMENT SUNSET SQUARE,,,,,,,,,,
VILLA BEGONIA BEGONIA LANE,VILLA BEGONIA,1,BEGONIA LANE,VILLA BEGONIA,1 BEGONIA LANE VILLA BEGONIA SINGAPORE 805817,805817,31155.4275608957,40897.3614534829,1.38613555395882,103.861672507221
LANDED HOUSING DEVELOPMENT MERAGI TERRACE,,,,,,,,,,
EAST COAST HILL SENNETT AVENUE,EAST COAST HILL,1,SENNETT AVENUE,EAST COAST HILL,1 SENNETT AVENUE EAST COAST HILL SINGAPORE 467013,467013,39356.4348682184,33245.6627510227,1.31693438236998,103.935361888398
LANDED HOUSING DEVELOPMENT JALAN NAGA SARI,,,,,,,,,,
LANDED HOUSING DEVELOPMENT BRIGHTON AVENUE,,,,,,,,,,
LANDED HOUSING DEVELOPMENT CORNWALL GARDENS,,,,,,,,,,
LANDED HOUSING DEVELOPMENT JALAN ISHAK,,,,,,,,,,
LANDED HOUSING DEVELOPMENT SIMS VIEW,,,,,,,,,,
JERVOIS VILLE JERVOIS ROAD,,,,,,,,,,
SEMBAWANG PARK JALAN LENGKOK SEMBAWANG,SEMBAWANG PARK,5,JALAN LENGKOK SEMBAWANG,SEMBAWANG PARK,5 JALAN LENGKOK SEMBAWANG SEMBAWANG PARK SINGAPORE 759197,759197,27209.2993565062,45515.6461715475,1.42790181795873,103.826213402148
LUXUS HILLS SELETAR GREEN WALK,LUXUS HILLS,1,SELETAR GREEN WALK,LUXUS HILLS,1 SELETAR GREEN WALK LUXUS HILLS SINGAPORE 805203,805203,32500.1615250977,40254.6267215014,1.38032271616461,103.873755869671
THOMSON HILLS ESTATE THOMSON CLOSE,THOMSON HILLS ESTATE,2,THOMSON CLOSE,THOMSON HILLS ESTATE,2 THOMSON CLOSE THOMSON HILLS ESTATE SINGAPORE 575012,575012,28099.333110407,39946.3519383427,1.37753513487016,103.83421115951
SIEW LIM PARK BEDOK LANE,SIEW LIM PARK,1,BEDOK LANE,SIEW LIM PARK,1 BEDOK LANE SIEW LIM PARK SINGAPORE 469767,469767,40791.2706268858,34653.6374599524,1.32966701728451,103.948255182748
SEMBAWANG SPRINGS ESTATE SEMBAWANG ROAD,SEMBAWANG SPRINGS ESTATE,534,SEMBAWANG ROAD,SEMBAWANG SPRINGS ESTATE,534 SEMBAWANG ROAD SEMBAWANG SPRINGS ESTATE SINGAPORE 758407,758407,27177.476809145,46525.057155909,1.4370305645273,103.825927417832
KIMNAN PARK JALAN SENYUM,KIMNAN PARK,71,JALAN SENYUM,KIMNAN PARK,71 JALAN SENYUM KIMNAN PARK SINGAPORE 418178,418178,36988.4114134926,34010.6431497429,1.323853372864,103.914084239645
LANDED HOUSING DEVELOPMENT LEEDON PARK,,,,,,,,,,
LANDED HOUSING DEVELOPMENT NAMLY VIEW,,,,,,,,,,
LANDED HOUSING DEVELOPMENT HEMMANT ROAD,,,,,,,,,,
SENTOSA COVE TREASURE ISLAND,SENTOSA COVE,1,TREASURE ISLAND,SENTOSA COVE,1 TREASURE ISLAND SENTOSA COVE SINGAPORE 098332,098332,29016.8721075431,25766.2607018389,1.24929537923786,103.84245545438
GOLDHILL GARDENS GOLDHILL AVENUE,GOLDHILL GARDENS,1,GOLDHILL AVENUE,GOLDHILL GARDENS,1 GOLDHILL AVENUE GOLDHILL GARDENS SINGAPORE 308999,308999,27809.916976111,33523.0951549374,1.31944548375298,103.831610584414
BAN GUAN PARK HOLLAND ROAD,BAN GUAN PARK,442B,HOLLAND ROAD,BAN GUAN PARK,442B HOLLAND ROAD BAN GUAN PARK SINGAPORE 275756,275756,22512.3106769947,33887.8343774322,1.32274356367187,103.784008781374
TEACHER'S HOUSING ESTATE IQBAL AVENUE,TEACHER'S HOUSING ESTATE,1,IQBAL AVENUE,TEACHER'S HOUSING ESTATE,1 IQBAL AVENUE TEACHER'S HOUSING ESTATE SINGAPORE 789444,789444,27694.5774946781,40245.1542954613,1.38023739502373,103.830574130746
LANDED HOUSING DEVELOPMENT GREENBANK PARK,,,,,,,,,,
SERANGOON GARDEN ESTATE BODMIN DRIVE,SERANGOON GARDEN ESTATE,1,BODMIN DRIVE,SERANGOON GARDEN ESTATE,1 BODMIN DRIVE SERANGOON GARDEN ESTATE SINGAPORE 559601,559601,31382.7926941002,38078.925460225,1.3606466042617,103.863715234671
SEMBAWANG GARDEN ARCADE JALAN LEGUNDI,SEMBAWANG GARDEN ARCADE,1,JALAN LEGUNDI,SEMBAWANG GARDEN ARCADE,1 JALAN LEGUNDI SEMBAWANG GARDEN ARCADE SINGAPORE 759263,759263,26948.8387558851,47006.2566832751,1.44138235091789,103.823872867498
SEASIDE PARK JALAN PUTERI JULA JULI,SEASIDE PARK,1,JALAN PUTERI JULA JULI,SEASIDE PARK,1 JALAN PUTERI JULA JULI SEASIDE PARK SINGAPORE 457465,457465,37728.2381794369,32448.4956810959,1.3097256526082,103.920731479867
LANDED HOUSING DEVELOPMENT CHWEE CHIAN ROAD,,,,,,,,,,
LANDED HOUSING DEVELOPMENT EASTWOOD ROAD,,,,,,,,,,
PEAKVIEW ESTATE PEAKVILLE AVENUE,PEAKVIEW ESTATE,1,PEAKVILLE AVENUE,PEAKVIEW ESTATE,1 PEAKVILLE AVENUE PEAKVIEW ESTATE SINGAPORE 487770,487770,40365.2319573341,34931.952448003,1.33218417103132,103.944427108459
SANNY PARK MERRYN DRIVE,SANNY PARK,1,MERRYN DRIVE,SANNY PARK,1 MERRYN DRIVE SANNY PARK SINGAPORE 298541,298541,27215.7790356567,34001.6475957874,1.3237733333237,103.826271934223
LANDED HOUSING DEVELOPMENT BUKIT TIMAH ROAD,,,,,,,,,,
LANDED HOUSING DEVELOPMENT LORONG 10 GEYLANG,,,,,,,,,,
OPERA ESTATE JALAN BINTANG TIGA,OPERA ESTATE,1,JALAN BINTANG TIGA,OPERA ESTATE,1 JALAN BINTANG TIGA OPERA ESTATE SINGAPORE 457741,457741,38239.466331305,33793.349839462,1.32188785751166,103.925325552437
HILLVIEW VILLAS HILLVIEW DRIVE,HILLVIEW VILLAS,1,HILLVIEW DRIVE,HILLVIEW VILLAS,1 HILLVIEW DRIVE HILLVIEW VILLAS SINGAPORE 669363,669363,19858.6942975326,37383.2325926777,1.35435408687573,103.76016370543
HEETON CLASSIC THONG SOON GREEN,,,,,,,,,,
SEMBAWANG SPRINGS ESTATE JALAN SAJAK,SEMBAWANG SPRINGS ESTATE,29,JALAN SAJAK,SEMBAWANG SPRINGS ESTATE,29 JALAN SAJAK SEMBAWANG SPRINGS ESTATE SINGAPORE 769579,769579,27392.9061867222,46611.2099470757,1.43780970463748,103.827863255757
SERANGOON GARDEN ESTATE HUDDINGTON AVENUE,SERANGOON GARDEN ESTATE,1,HUDDINGTON AVENUE,SERANGOON GARDEN ESTATE,1 HUDDINGTON AVENUE SERANGOON GARDEN ESTATE SINGAPORE 557572,557572,31651.7664678218,38705.6575697493,1.36631451315574,103.866132220454
TIVOLI GARDENS TAI KENG GARDENS,TIVOLI GARDENS,1,TAI KENG PLACE,TIVOLI GARDENS,1 TAI KENG PLACE TIVOLI GARDENS SINGAPORE 534327,534327,33831.1773126479,36450.3730015624,1.3459181818476,103.885715287859
FUDU PARK LENTOR GROVE,FUDU PARK,1,LENTOR GROVE,FUDU PARK,1 LENTOR GROVE FUDU PARK SINGAPORE 789175,789175,28474.1236643996,41019.8535016105,1.38724349493487,103.837578944378
PASIR RIS BEACH PARK PASIR RIS HEIGHTS,PASIR RIS BEACH PARK,1,PASIR RIS HEIGHTS,PASIR RIS BEACH PARK,1 PASIR RIS HEIGHTS PASIR RIS BEACH PARK SINGAPORE 519208,519208,40284.8193682078,40265.2215751819,1.3804163003519,103.943706742355
THOMSON GARDEN ESTATE JALAN CHEGAR,THOMSON GARDEN ESTATE,1,JALAN CHEGAR,THOMSON GARDEN ESTATE,1 JALAN CHEGAR THOMSON GARDEN ESTATE SINGAPORE 578470,578470,28565.8433733992,37331.1878843233,1.35388451913049,103.838403046335
LANDED HOUSING DEVELOPMENT JALAN POKOK SERUNAI,,,,,,,,,,
SIEW LIM PARK UPPER BEDOK ROAD,SIEW LIM PARK,1,UPPER BEDOK ROAD,SIEW LIM PARK,1 UPPER BEDOK ROAD SIEW LIM PARK SINGAPORE 466636,466636,40769.6195446486,34619.5437847003,1.32935869588678,103.948060621892
LANDED HOUSING DEVELOPMENT CRANE ROAD,,,,,,,,,,
SENNETT ESTATE JALAN WANGI,SENNETT ESTATE,1,JALAN WANGI,SENNETT ESTATE,1 JALAN WANGI SENNETT ESTATE SINGAPORE 349350,349350,32547.7263902538,34682.5656616371,1.3299309852802,103.874182431008
GRACE PARK GRACE PARK,GRACE PARK (ROAD),,GRACE PARK (ROAD),NIL,GRACE PARK (ROAD),NIL,31968.9096491374,37745.544262344,1.35763155144852,103.868981842785
LANDED HOUSING DEVELOPMENT SENNETT ROAD,,,,,,,,,,
VAUGHAN GARDEN LORONG BIAWAK,VAUGHAN GARDEN,8,LORONG BIAWAK,VAUGHAN GARDEN,8 LORONG BIAWAK VAUGHAN GARDEN SINGAPORE 358766,358766,32126.7519478621,36634.156596804,1.34758053763439,103.870400007026
SELETAR HILLS ESTATE JALAN PELAJAU,SELETAR HILLS ESTATE,1,JALAN PELAJAU,SELETAR HILLS ESTATE,1 JALAN PELAJAU SELETAR HILLS ESTATE SINGAPORE 808696,808696,32250.7851206502,40845.8324813023,1.38566940539813,103.8715151234
EDEN PARK MAPLE AVENUE,EDEN PARK,1,MAPLE AVENUE,EDEN PARK,1 MAPLE AVENUE EDEN PARK SINGAPORE 277568,277568,23501.3279414317,34926.0225262418,1.33213272918684,103.792895471622
THE VILLAS @ SENTOSA COVE OCEAN DRIVE,THE VILLAS @ SENTOSA COVE,102,OCEAN DRIVE,THE VILLAS @ SENTOSA COVE,102 OCEAN DRIVE THE VILLAS @ SENTOSA COVE SINGAPORE 098575,098575,29336.8051797226,26088.7111319564,1.25221149686401,103.845330154013
TAI PENG GARDENS JALAN RENGKAM,TAI PENG GARDENS,1,JALAN RENGKAM,TAI PENG GARDENS,1 JALAN RENGKAM TAI PENG GARDENS SINGAPORE 537557,537557,34145.3404898951,38300.3826462235,1.36264894007541,103.88853861462
LANDED HOUSING DEVELOPMENT DIX ROAD,,,,,,,,,,
WESTLAKE GARDENS WESTLAKE AVENUE,WESTLAKE GARDENS,1,WESTLAKE AVENUE,WESTLAKE GARDENS,1 WESTLAKE AVENUE WESTLAKE GARDENS SINGAPORE 574210,574210,28402.2011539023,36418.0378658976,1.3456263177583,103.836932603376
BENA PARK JALAN PERNAMA,BENA PARK,1,JALAN PERNAMA,BENA PARK,1 JALAN PERNAMA BENA PARK SINGAPORE 499235,499235,43151.0130034098,37326.8604706917,1.35384154353976,103.969460065477
GOLDEN RISE ESTATE KISMIS PLACE,GOLDEN RISE ESTATE,1,KISMIS PLACE,GOLDEN RISE ESTATE,1 KISMIS PLACE GOLDEN RISE ESTATE SINGAPORE 598152,598152,20453.4439539379,35384.7506484762,1.33628069537978,103.765508410496
LANDED HOUSING DEVELOPMENT PROME ROAD,,,,,,,,,,
GREEN HILL ESTATE CHESTNUT CRESCENT,GREEN HILL ESTATE,1,CHESTNUT CRESCENT,GREEN HILL ESTATE,1 CHESTNUT CRESCENT GREEN HILL ESTATE SINGAPORE 679356,679356,21013.2625107868,39145.9196491372,1.37029548329325,103.770537826947
WATTEN ESTATE WATTEN HEIGHTS,WATTEN ESTATE,1,WATTEN HEIGHTS,WATTEN ESTATE,1 WATTEN HEIGHTS WATTEN ESTATE SINGAPORE 287443,287443,25261.5093536628,34856.5837156847,1.33150495935297,103.808711699962
GLASGOW GREEN GLASGOW ROAD,GLASGOW GREEN,2,GLASGOW ROAD,GLASGOW GREEN,2 GLASGOW ROAD GLASGOW GREEN SINGAPORE 549291,549291,32673.1361206742,38266.7719571888,1.36234524558297,103.875309861318
HOLLAND GARDENS MOONBEAM TERRACE,HOLLAND GARDENS,1,MOONBEAM TERRACE,HOLLAND GARDENS,1 MOONBEAM TERRACE HOLLAND GARDENS SINGAPORE 277292,277292,22285.3211089326,33487.9285099301,1.31912691619358,103.781969234572
PROSPER GARDENS BEDOK GARDEN,PROSPER GARDENS,2,BEDOK GARDEN,PROSPER GARDENS,2 BEDOK GARDEN PROSPER GARDENS SINGAPORE 469853,469853,41346.4177744677,33961.8550040256,1.32341055662134,103.953243176934
THE SPRINGSIDE SPRINGSIDE VIEW,,,,,,,,,,
RAINTREE VALLEY MUNSHI ABDULLAH WALK,RAINTREE VALLEY,1,MUNSHI ABDULLAH WALK,RAINTREE VALLEY,1 MUNSHI ABDULLAH WALK RAINTREE VALLEY SINGAPORE 788581,788581,27725.7271544924,40527.6288611759,1.38279199417322,103.830854030921
CHARLTON PARK TAMAN SIREH,CHARLTON PARK,1,TAMAN SIREH,CHARLTON PARK,1 TAMAN SIREH CHARLTON PARK SINGAPORE 535194,535194,33161.7619583812,37281.9806783702,1.35343906600642,103.879700323677
THE COUNTRYSIDE COUNTRYSIDE PLACE,,,,,,,,,,
LANDED HOUSING DEVELOPMENT RICHARDS AVENUE,,,,,,,,,,
LANDED HOUSING DEVELOPMENT BOURNEMOUTH ROAD,,,,,,,,,,
EATON PARK GERALD CRESCENT,EATON PARK,5A,GERALD CRESCENT,EATON PARK,5A GERALD CRESCENT EATON PARK SINGAPORE 799697,799697,32875.288023442,41033.2627329528,1.38736435921892,103.877126788159
LANDED HOUSING DEVELOPMENT BELMONT ROAD,,,,,,,,,,
FUYONG ESTATE JALAN UJI,FUYONG ESTATE,1,JALAN UJI,FUYONG ESTATE,1 JALAN UJI FUYONG ESTATE SINGAPORE 678355,678355,20784.479837101,37818.0382626411,1.35828655033005,103.768482376084
PEOPLE'S GARDEN LORONG 5 REALTY PARK,PEOPLE'S GARDEN,2,LORONG 5 REALTY PARK,PEOPLE'S GARDEN,2 LORONG 5 REALTY PARK PEOPLE'S GARDEN SINGAPORE 536880,536880,34190.0751169659,38918.6048818566,1.3682399094409,103.888940713812
SEMBAWANG GARDEN ARCADE JALAN DERUM,SEMBAWANG GARDEN ARCADE,1,JALAN DERUM,SEMBAWANG GARDEN ARCADE,1 JALAN DERUM SEMBAWANG GARDEN ARCADE SINGAPORE 759414,759414,26850.620783194,47001.6323104557,1.44134052590671,103.822990283243
KEMBANGAN ESTATE JALAN ISMAIL,KEMBANGAN ESTATE,3,JALAN ISMAIL,KEMBANGAN ESTATE,3 JALAN ISMAIL KEMBANGAN ESTATE SINGAPORE 419247,419247,36079.2574650813,33884.2468041275,1.32271054411908,103.905914978953
GUAN SOON TERRACE GUAN SOON AVENUE,GUAN SOON TERRACE,6,GUAN SOON AVENUE,GUAN SOON TERRACE,6 GUAN SOON AVENUE GUAN SOON TERRACE SINGAPORE 489579,489579,41431.5627325792,35492.4651405234,1.33725278433911,103.954008920639
HENRY PARK MOUNT SINAI ROAD,HENRY PARK,1,MOUNT SINAI ROAD,HENRY PARK,1 MOUNT SINAI ROAD HENRY PARK SINGAPORE 276836,276836,22445.6729261866,33129.181137491,1.31588256242917,103.783410142766
WHITE HOUSE PARK WHITE HOUSE PARK,WHITE HOUSE PARK (ROAD),,WHITE HOUSE PARK (ROAD),NIL,WHITE HOUSE PARK (ROAD),NIL,26801.8758796463,33152.8552104818,1.31609687671794,103.822552413419
SEMBAWANG HILLS ESTATE JALAN RUKAM,SEMBAWANG HILLS ESTATE,1,JALAN RUKAM,SEMBAWANG HILLS ESTATE,1 JALAN RUKAM SEMBAWANG HILLS ESTATE SINGAPORE 576938,576938,27617.373311826,39317.687036451,1.37184971189883,103.829880405898
LANDED HOUSING DEVELOPMENT ST. MICHAEL'S ROAD,,,,,,,,,,
LANDED HOUSING DEVELOPMENT JALAN BUNGA RAMPAI,,,,,,,,,,
SELETAR HILLS ESTATE JALAN KERUING,SELETAR HILLS ESTATE,2,JALAN KERUING,SELETAR HILLS ESTATE,2 JALAN KERUING SELETAR HILLS ESTATE SINGAPORE 808926,808926,32389.726667746,40768.4001989253,1.38496911516779,103.872763607344
FLORENCE GROVE FLORENCE CLOSE,FLORENCE GROVE,1,FLORENCE CLOSE,FLORENCE GROVE,1 FLORENCE CLOSE FLORENCE GROVE SINGAPORE 549588,549588,33897.7287997017,38207.1805021856,1.361806103754,103.886313638552
LANDED HOUSING DEVELOPMENT GOODLINK PARK,,,,,,,,,,
SELETAR HILLS ESTATE JALAN BANGAU,SELETAR HILLS ESTATE,1,JALAN BANGAU,SELETAR HILLS ESTATE,1 JALAN BANGAU SELETAR HILLS ESTATE SINGAPORE 809346,809346,32223.7634387231,40542.5119617172,1.38292628780836,103.871272269425
SENNETT ESTATE SIAK KEW AVENUE,SENNETT ESTATE,1,SIAK KEW AVENUE,SENNETT ESTATE,1 SIAK KEW AVENUE SENNETT ESTATE SINGAPORE 348037,348037,32120.7476576641,34684.997966541,1.32995304307557,103.870345790419
LANDED HOUSING DEVELOPMENT MARGOLIOUTH ROAD,,,,,,,,,,
LANDED HOUSING DEVELOPMENT CHESTNUT LANE,,,,,,,,,,
LANDED HOUSING DEVELOPMENT WESTRIDGE WALK,,,,,,,,,,
CHUAN TERRACE CHUAN TERRACE,CHUAN TERRACE,,CHUAN TERRACE,NIL,CHUAN TERRACE,NIL,31784.608081379,38233.9803978073,1.36204883896968,103.867325530053
MIMOSA VILLAS MIMOSA WALK,MIMOSA VILLAS,15,MIMOSA WALK,MIMOSA VILLAS,15 MIMOSA WALK MIMOSA VILLAS SINGAPORE 807862,807862,31126.7885092581,40506.1893521454,1.38259793711842,103.861415121851
LANDED HOUSING DEVELOPMENT KANG CHOO BIN ROAD,,,,,,,,,,
SENNETT ESTATE WILLOW AVENUE,SENNETT ESTATE,2,WILLOW AVENUE,SENNETT ESTATE,2 WILLOW AVENUE SENNETT ESTATE SINGAPORE 347496,347496,32633.5450228797,35007.1938731838,1.33286679408001,103.874953608269
LANDED HOUSING DEVELOPMENT SHREWSBURY ROAD,,,,,,,,,,
HAUS@SERANGOON GARDEN SERANGOON GARDEN RISE,HAUS@SERANGOON GARDEN,1,SERANGOON GARDEN RISE,HAUS@SERANGOON GARDEN,1 SERANGOON GARDEN RISE HAUS@SERANGOON GARDEN SINGAPORE 554397,554397,31025.8424226586,38594.9343190491,1.36531324233969,103.860507850209
LANDED HOUSING DEVELOPMENT JALAN MAWAR,,,,,,,,,,
BUKIT LOYANG ESTATE JALAN CHELAGI,BUKIT LOYANG ESTATE,2,JALAN CHELAGI,BUKIT LOYANG ESTATE,2 JALAN CHELAGI BUKIT LOYANG ESTATE SINGAPORE 509565,509565,42598.1212746352,38074.8809614368,1.36060663214275,103.96449235505
JALAN KAYU ESTATE LORONG TANGGAM,JALAN KAYU ESTATE,100,LORONG TANGGAM,JALAN KAYU ESTATE,100 LORONG TANGGAM JALAN KAYU ESTATE SINGAPORE 798783,798783,32473.1777689541,41928.4975253008,1.3954606040096,103.873513656117
GREEN PARK JALAN LIMAU KASTURI,,,,,,,,,,
SWISS CLUB PARK SWISS CLUB ROAD,SWISS CLUB PARK,1,SWISS CLUB ROAD,SWISS CLUB PARK,1 SWISS CLUB ROAD SWISS CLUB PARK SINGAPORE 288085,288085,23275.355286818,35150.9316547122,1.33416669270442,103.7908649453
LANDED HOUSING DEVELOPMENT NAMLY DRIVE,,,,,,,,,,
LANDED HOUSING DEVELOPMENT JALAN TANAH PUTEH,,,,,,,,,,
LANDED HOUSING DEVELOPMENT HAPPY AVENUE NORTH,,,,,,,,,,
