QUERY,SEARCHVAL,BLK_NO,ROAD_NAME,BUILDING,ADDRESS,POSTAL,X,Y,LATITUDE,LONGITUDE
GAMBIER COURT KIM YAM ROAD,GAMBIER COURT,60,KIM YAM ROAD,GAMBIER COURT,60 KIM YAM ROAD GAMBIER COURT SINGAPORE 239361,239361,28717.2249709992,30582.460047096,1.29285140857469,103.83976315039
RESIDENTIAL APARTMENTS CAMBRIDGE ROAD,,,,,,,,,,
SOMMERVILLE LOFT SOMMERVILLE WALK,SOMMERVILLE LOFT,7,SOMMERVILLE WALK,SOMMERVILLE LOFT,7 SOMMERVILLE WALK SOMMERVILLE LOFT SINGAPORE 358178,358178,32058.8521734728,36201.702749176,1.34366958875438,103.869789827423
EVELYN MANSIONS EVELYN ROAD,EVELYN MANSIONS,20,EVELYN ROAD,EVELYN MANSIONS,20 EVELYN ROAD EVELYN MANSIONS SINGAPORE 309309,309309,28643.8483260283,33196.8078038637,1.31649465009912,103.839103883927
TANQUEELAN SUITES TAN QUEE LAN STREET,TANQUEELAN SUITES,9,TAN QUEE LAN STREET,TANQUEELAN SUITES,9 TAN QUEE LAN STREET TANQUEELAN SUITES SINGAPORE 188098,188098,30596.8327083606,31186.1460835505,1.29831083277688,103.856652273902
MORO MANSIONS LORONG 37 GEYLANG,MORO MANSIONS,3,LORONG 37 GEYLANG,MORO MANSIONS,3 LORONG 37 GEYLANG MORO MANSIONS SINGAPORE 387901,387901,34244.6723546553,33063.4636847284,1.31528810526081,103.889430101654
EUNOS PARK KAMPONG EUNOS,EUNOS PARK,5,KAMPONG EUNOS,EUNOS PARK,5 KAMPONG EUNOS EUNOS PARK SINGAPORE 417771,417771,36097.2798095541,33414.6755702104,1.31846390653038,103.9060767957
SUNFLOWER REGENCY LORONG 20 GEYLANG,SUNFLOWER REGENCY,37,LORONG 20 GEYLANG,SUNFLOWER REGENCY,37 LORONG 20 GEYLANG SUNFLOWER REGENCY SINGAPORE 398753,398753,33363.9272698658,32620.7363386024,1.3112844032004,103.881516089364
INTERO LEICESTER ROAD,INTERO,8,LEICESTER ROAD,INTERO,8 LEICESTER ROAD INTERO SINGAPORE 358841,358841,31787.6266433708,34717.7361204103,1.33024915863509,103.86735251711
THE HOLLAND COLLECTION HOLLAND ROAD,THE HOLLAND COLLECTION,53,HOLLAND ROAD,THE HOLLAND COLLECTION,53 HOLLAND ROAD THE HOLLAND COLLECTION SINGAPORE 258859,258859,25145.4839694509,32354.9340139478,1.30888091521005,103.807669378659
ROBIN REGALIA ROBIN ROAD,ROBIN REGALIA,35,ROBIN ROAD,ROBIN REGALIA,35 ROBIN ROAD ROBIN REGALIA SINGAPORE 258210,258210,27447.8997836588,33220.4670457486,1.31670861764983,103.828357677349
TANGLIN RESIDENCES ST. MARTIN'S DRIVE,TANGLIN RESIDENCES,23,SAINT MARTIN'S DRIVE,TANGLIN RESIDENCES,23 SAINT MARTIN'S DRIVE TANGLIN RESIDENCES SINGAPORE 258004,258004,26898.4275803445,32070.3683543094,1.30630751616401,103.823420430568
BOAT QUAY CONSERVATION AREA BOAT QUAY,BOAT QUAY CONSERVATION AREA,1,CIRCULAR ROAD,BOAT QUAY CONSERVATION AREA,1 CIRCULAR ROAD BOAT QUAY CONSERVATION AREA SINGAPORE 049357,049357,29737.8639244568,30061.8304476105,1.28814297750701,103.848933996224
CITY SUITES BALESTIER ROAD,CITY SUITES,235,BALESTIER ROAD,CITY SUITES,235 BALESTIER ROAD CITY SUITES SINGAPORE 329699,329699,30099.0287402188,33727.2187747005,1.3212914342901,103.852179456118
THE FOLIAGE PASIR PANJANG ROAD,THE FOLIAGE,370,PASIR PANJANG ROAD,THE FOLIAGE,370 PASIR PANJANG ROAD THE FOLIAGE SINGAPORE 118707,118707,21433.9191696178,30365.0710294489,1.2908847377725,103.774319608719
SIMS POINT LORONG 19 GEYLANG,SIMS POINT,4,LORONG 19 GEYLANG,SIMS POINT,4 LORONG 19 GEYLANG SIMS POINT SINGAPORE 388489,388489,33136.7449250147,32823.9429595303,1.31312217027915,103.879474779
GILSTEAD 38 GILSTEAD ROAD,GILSTEAD 38,38,GILSTEAD ROAD,GILSTEAD 38,38 GILSTEAD ROAD GILSTEAD 38 SINGAPORE 309082,309082,28649.1010016548,33378.9488767013,1.31814186950603,103.839151085711
HOLLAND SUITES HOLLAND ROAD,HOLLAND SUITES,129,HOLLAND ROAD,HOLLAND SUITES,129 HOLLAND ROAD HOLLAND SUITES SINGAPORE 278568,278568,24219.1799090542,32693.1600869093,1.31193961236165,103.799346050449
KEMBANGAN SUITES JALAN MASJID,KEMBANGAN SUITES,16,JALAN MASJID,KEMBANGAN SUITES,16 JALAN MASJID KEMBANGAN SUITES SINGAPORE 418941,418941,36837.3865240803,33601.4221589137,1.32015257058639,103.912727083961
DERBYSHIRE HEIGHTS DERBYSHIRE ROAD,DERBYSHIRE HEIGHTS,3,DERBYSHIRE ROAD,DERBYSHIRE HEIGHTS,3 DERBYSHIRE ROAD DERBYSHIRE HEIGHTS SINGAPORE 309459,309459,29357.7641542442,33155.7607555166,1.31612341185444,103.845518779011
RESIDENTIAL APARTMENTS BALESTIER ROAD,,,,,,,,,,
LE ARC LORONG 26 GEYLANG,LE ARC,6,LORONG 26 GEYLANG,LE ARC,6 LORONG 26 GEYLANG LE ARC SINGAPORE 398481,398481,33705.3416511612,32765.9694493301,1.31259777837018,103.884583890504
APLETON VIEW SINARAN DRIVE,APLETON VIEW,71,SINARAN DRIVE,APLETON VIEW,71 SINARAN DRIVE APLETON VIEW SINGAPORE 308323,308323,29422.6104641678,33481.5491388794,1.31906972390327,103.846101471001
ENG AUN MANSION THOMSON ROAD,ENG AUN MANSION,304,THOMSON ROAD,ENG AUN MANSION,304 THOMSON ROAD ENG AUN MANSION SINGAPORE 307654,307654,28972.056271472,33933.9078784958,1.32316071397544,103.842053022507
D'CAMBRIDGE CAMBRIDGE ROAD,,,,,,,,,,
RESIDENTIAL APARTMENTS WESTERHOUT ROAD,,,,,,,,,,
RESIDENTIAL APARTMENTS LORONG 4 GEYLANG,,,,,,,,,,
THE MKZ MACKENZIE ROAD,THE MKZ,131,MACKENZIE ROAD,THE MKZ,131 MACKENZIE ROAD THE MKZ SINGAPORE 228714,228714,29476.6938120294,32094.1008144468,1.30652212866478,103.846587371813
WILKIE STUDIO WILKIE ROAD,WILKIE STUDIO,86,WILKIE ROAD,WILKIE STUDIO,86 WILKIE ROAD WILKIE STUDIO SINGAPORE 228096,228096,29590.6723238425,31753.1233514957,1.30343844307623,103.847611505264
RESIDENTIAL APARTMENTS LORONG 34 GEYLANG,,,,,,,,,,
D'MIRA BOON TECK ROAD,D'MIRA,31,BOON TECK ROAD,D'MIRA,31 BOON TECK ROAD D'MIRA SINGAPORE 329602,329602,29840.2237983076,34415.7613759171,1.32751838640442,103.849853998922
KENT RESIDENCES KENT ROAD,KENT RIDGE HILL RESIDENCES,56F,SOUTH BUONA VISTA ROAD,KENT RIDGE HILL RESIDENCES,56F SOUTH BUONA VISTA ROAD KENT RIDGE HILL RESIDENCES SINGAPORE 117293,117293,23260.0976805137,29252.5672017429,1.28082397634044,103.790728746282
HOA NAM BUILDING FOCH ROAD,HOA NAM BUILDING,27,FOCH ROAD,HOA NAM BUILDING,27 FOCH ROAD HOA NAM BUILDING SINGAPORE 209264,209264,30965.9111792706,32777.4334178958,1.31270184017357,103.859968759019
SUNNY GROVE LORONG 37 GEYLANG,SUNNY GROVE,5A,LORONG 37 GEYLANG,SUNNY GROVE,5A LORONG 37 GEYLANG SUNNY GROVE SINGAPORE 387914,387914,34248.2261186233,33096.028796535,1.31558261176887,103.889462040581
DLV. DALVEY ROAD,DLV.,70,DALVEY ROAD,DLV.,70 DALVEY ROAD DLV. SINGAPORE 259469,259469,27085.7485645749,33083.7413572036,1.31547211014542,103.825103568175
HIJAUAN CAVENAGH ROAD,HIJAUAN,63,CAVENAGH ROAD,HIJAUAN,63 CAVENAGH ROAD HIJAUAN SINGAPORE 229618,229618,28867.8778366232,31771.0639421456,1.30360072008439,103.841116863266
URBAN HERITAGE BALESTIER ROAD,URBAN HERITAGE,238,BALESTIER ROAD,URBAN HERITAGE,238 BALESTIER ROAD URBAN HERITAGE SINGAPORE 329701,329701,30227.5306175873,33788.3350701872,1.32184413934142,103.853334117435
NEW COURT JALAN DUSUN,NEW COURT,35,JALAN DUSUN,NEW COURT,35 JALAN DUSUN NEW COURT SINGAPORE 329387,329387,29152.5709244721,34483.2414241768,1.32812868583745,103.843675063421
PASIR PANJANG LODGE PASIR PANJANG ROAD,CHARIS LODGE,367C,PASIR PANJANG ROAD,CHARIS LODGE,367C PASIR PANJANG ROAD CHARIS LODGE SINGAPORE 117672,117672,21438.1351970695,30238.1031032279,1.28973648594562,103.774357517912
CENTENNIA SUITES KIM SENG ROAD,CENTENNIA SUITES,100,KIM SENG ROAD,CENTENNIA SUITES,100 KIM SENG ROAD CENTENNIA SUITES SINGAPORE 239427,239427,28030.211024031,30591.5827871207,1.29293391960903,103.833590038162
CASA CAIRNHILL PECK HAY ROAD,CASA CAIRNHILL,1,PECK HAY ROAD,CASA CAIRNHILL,1 PECK HAY ROAD CASA CAIRNHILL SINGAPORE 228305,228305,28693.0608591456,32269.4477237836,1.30810793174444,103.839546062882
HOLT RESIDENCES HOLT ROAD,HOLT RESIDENCES,5,HOLT ROAD,HOLT RESIDENCES,5 HOLT ROAD HOLT RESIDENCES SINGAPORE 249444,249444,27193.0527135655,30714.1932436023,1.29404275502161,103.826067811629
THE PEAK @ CAIRNHILL I CAIRNHILL CIRCLE,THE PEAK @ CAIRNHILL I,51,CAIRNHILL CIRCLE,THE PEAK @ CAIRNHILL I,51 CAIRNHILL CIRCLE THE PEAK @ CAIRNHILL I SINGAPORE 229784,229784,28562.6460149391,32278.8242911194,1.30819273275748,103.838374223228
GEYLANG HERITAGE LORONG 34 GEYLANG,GEYLANG HERITAGE,26,LORONG 34 GEYLANG,GEYLANG HERITAGE,26 LORONG 34 GEYLANG GEYLANG HERITAGE SINGAPORE 398223,398223,34032.2585157594,32812.8208678421,1.31302142355877,103.887521408189
ORCHARD VIEW ANGULLIA PARK,ORCHARD VIEW,29,ANGULLIA PARK,ORCHARD VIEW,29 ANGULLIA PARK ORCHARD VIEW SINGAPORE 239977,239977,27571.604700163,31651.2485826202,1.30251716129553,103.829469250792
SOHO 188 RACE COURSE ROAD,SOHO 188,188,RACE COURSE ROAD,SOHO 188,188 RACE COURSE ROAD SOHO 188 SINGAPORE 218612,218612,30221.0435227808,32610.484209301,1.31119207325572,103.85327574283
BELMONDO VIEW PEGU ROAD,BELMONDO VIEW,20,PEGU ROAD,BELMONDO VIEW,20 PEGU ROAD BELMONDO VIEW SINGAPORE 328369,328369,29991.7599442331,33945.2024371549,1.32326280853007,103.851215603717
RANGOON APARTMENTS RANGOON ROAD,R66 APARTMENTS,60,RANGOON ROAD,R66 APARTMENTS,60 RANGOON ROAD R66 APARTMENTS SINGAPORE 218350,218350,30344.7313378751,32925.9703698494,1.31404520941052,103.854387162231
WATTEN HILL WATTEN ESTATE ROAD,WATTEN HILL,63,WATTEN ESTATE ROAD,WATTEN HILL,63 WATTEN ESTATE ROAD WATTEN HILL SINGAPORE 287538,287538,25385.3659733022,34692.9552378524,1.33002517241603,103.809824635314
YONG SIAK COURT YONG SIAK STREET,YONG SIAK COURT,11,YONG SIAK STREET,YONG SIAK COURT,11 YONG SIAK STREET YONG SIAK COURT SINGAPORE 168646,168646,27651.40614843,29452.8795980681,1.28263588582996,103.83018632791
VILLE ROYALE RIVER VALLEY ROAD,VILLE ROYALE,310,RIVER VALLEY ROAD,VILLE ROYALE,310 RIVER VALLEY ROAD VILLE ROYALE SINGAPORE 238351,238351,28884.0251400406,30929.4711601902,1.29598965078724,103.841261930523
THE LUMOS LEONIE HILL,THE LUMOS,9,LEONIE HILL,THE LUMOS,9 LEONIE HILL THE LUMOS SINGAPORE 239220,239220,27860.8894411419,31269.6375017129,1.29906600768056,103.832068608699
PARC MACKENZIE MACKENZIE ROAD,PARC MACKENZIE,68,MACKENZIE ROAD,PARC MACKENZIE,68 MACKENZIE ROAD PARC MACKENZIE SINGAPORE 228687,228687,29620.1601502793,32064.6102941595,1.3062554196251,103.847876483186
VILLA DE WEST PASIR PANJANG ROAD,VILLA DE WEST,385,PASIR PANJANG ROAD,VILLA DE WEST,385 PASIR PANJANG ROAD VILLA DE WEST SINGAPORE 118719,118719,21188.5038756635,30347.4460733347,1.29072529149112,103.772114454747
MUTIARA CREST JALAN MUTIARA,MUTIARA CREST,2,JALAN MUTIARA,MUTIARA CREST,2 JALAN MUTIARA MUTIARA CREST SINGAPORE 249183,249183,27561.2446957687,30916.063442247,1.29586840547876,103.829376171741
SUMMER VIEW LORONG 12 GEYLANG,SUMMER VIEW,5,LORONG 12 GEYLANG,SUMMER VIEW,5 LORONG 12 GEYLANG SUMMER VIEW SINGAPORE 398986,398986,33024.1642189575,32667.6966310516,1.31170915264394,103.878463160426
LEONIE PARC VIEW LEONIE HILL ROAD,LEONIE PARC VIEW,22,LEONIE HILL ROAD,LEONIE PARC VIEW,22 LEONIE HILL ROAD LEONIE PARC VIEW SINGAPORE 239195,239195,28105.7109983275,31260.5677306596,1.29898398400724,103.834268439755
DE PARADISO MARTABAN ROAD,DE PARADISO,20,MARTABAN ROAD,DE PARADISO,20 MARTABAN ROAD DE PARADISO SINGAPORE 328644,328644,29926.50680234,34035.8825014494,1.32408289110494,103.85062927516
HERTFORD COLLECTION HERTFORD ROAD,HERTFORD COLLECTION,40,HERTFORD ROAD,HERTFORD COLLECTION,40 HERTFORD ROAD HERTFORD COLLECTION SINGAPORE 219408,219408,29740.0092586065,32838.8452197071,1.31325732047152,103.848953427343
SAGE NASSIM ROAD,SAGE,11A,NASSIM ROAD,SAGE,11A NASSIM ROAD SAGE SINGAPORE 258379,258379,27002.6012933878,32184.4960267469,1.30733965013533,103.824356476923
BALMORAL CREST BALMORAL CRESCENT,BALMORAL CREST,1,BALMORAL CRESCENT,BALMORAL CREST,1 BALMORAL CRESCENT BALMORAL CREST SINGAPORE 259882,259882,28076.94554759,33126.2204443961,1.31585628957472,103.834009973852
ONE ST MICHAEL'S ST. MICHAEL'S ROAD,ONE SAINT MICHAEL'S,1,SAINT MICHAEL'S ROAD,ONE SAINT MICHAEL'S,1 SAINT MICHAEL'S ROAD ONE SAINT MICHAEL'S SINGAPORE 328006,328006,31482.3072866779,34104.5634319633,1.3247038792419,103.864608983
CAMELLIA LODGE LORONG 31 GEYLANG,CAMELLIA LODGE,31,LORONG 31 GEYLANG,CAMELLIA LODGE,31 LORONG 31 GEYLANG CAMELLIA LODGE SINGAPORE 388030,388030,33922.5739714568,33070.8944747318,1.31535537044873,103.886535887931
RACE COURSE MANSION RACE COURSE ROAD,RACE COURSE MANSION,122,RACE COURSE ROAD,RACE COURSE MANSION,122 RACE COURSE ROAD RACE COURSE MANSION SINGAPORE 218583,218583,30090.6015584609,32429.2553529572,1.30955311261014,103.852103645749
BLOSSOM VIEW LORONG 26 GEYLANG,BLOSSOM VIEW,31,LORONG 26 GEYLANG,BLOSSOM VIEW,31 LORONG 26 GEYLANG BLOSSOM VIEW SINGAPORE 398498,398498,33758.3225179836,32660.9195689615,1.31164773484524,103.885059930105
28 SHELFORD SHELFORD ROAD,28 SHELFORD ROAD SINGAPORE 288422,28,SHELFORD ROAD,NIL,28 SHELFORD ROAD SINGAPORE 288422,288422,25601.7715236228,34578.8734516799,1.32899347508174,103.811769168631
GOODVIEW APARTMENTS LORONG 8 GEYLANG,GOODVIEW APARTMENTS,6,LORONG 8 GEYLANG,GOODVIEW APARTMENTS,6 LORONG 8 GEYLANG GOODVIEW APARTMENTS SINGAPORE 399077,399077,32843.307537742,32659.9206952304,1.31163885880473,103.87683807349
CANBERLIN APARTMENTS LORONG 16 GEYLANG,CANBERLIN APARTMENTS,60,LORONG 16 GEYLANG,CANBERLIN APARTMENTS,60 LORONG 16 GEYLANG CANBERLIN APARTMENTS SINGAPORE 398887,398887,33176.8063267395,32554.3929439355,1.31068444913989,103.879834705472
THE BALMORAL BALMORAL PARK,THE SOLITAIRE,5,BALMORAL PARK,THE SOLITAIRE,5 BALMORAL PARK THE SOLITAIRE SINGAPORE 259866,259866,27303.7582272282,33007.8466278631,1.31478575074088,103.82706249682
ASPEN LINQ INSTITUTION HILL,ASPEN LINQ,15,INSTITUTION HILL,ASPEN LINQ,15 INSTITUTION HILL ASPEN LINQ SINGAPORE 239669,239669,28726.2650491595,30857.8103769477,1.2953415799343,103.839844385683
VOGX DORSET ROAD,VOGX,109,DORSET ROAD,VOGX,109 DORSET ROAD VOGX SINGAPORE 219498,219498,29906.6316637797,32907.3295596652,1.31387665877617,103.850450616658
RESIDENTIAL APARTMENTS SAM LEONG ROAD,,,,,,,,,,
EURO-ASIA APARTMENTS SERANGOON ROAD,,,,,,,,,,
THE SCENIC @ BRADDELL BRADDELL ROAD,THE SCENIC @ BRADDELL,52,BRADDELL ROAD,THE SCENIC @ BRADDELL,52 BRADDELL ROAD THE SCENIC @ BRADDELL SINGAPORE 359944,359944,31955.1177396774,36177.8199782316,1.34345361531638,103.868857707623
TOP TEN EMERALD HILL ROAD,TOP TEN,134,EMERALD HILL ROAD,TOP TEN,134 EMERALD HILL ROAD TOP TEN SINGAPORE 229414,229414,28710.7833387041,31908.5641278569,1.30484422731081,103.839705299625
PARK 1 SUITES LORONG 40 GEYLANG,PARK 1 SUITES,8,LORONG 40 GEYLANG,PARK 1 SUITES,8 LORONG 40 GEYLANG PARK 1 SUITES SINGAPORE 398054,398054,34235.43208405,32925.7515625954,1.31404268792091,103.889347045446
RESIDENTIAL APARTMENTS SURREY ROAD,,,,,,,,,,
STEVENS SUITES STEVENS CLOSE,STEVENS SUITES,2,STEVENS CLOSE,STEVENS SUITES,2 STEVENS CLOSE STEVENS SUITES SINGAPORE 257940,257940,27143.6883259732,33086.8774835337,1.31550047383755,103.825624186108
BOUGAINVILLA APARTMENTS LORONG 19 GEYLANG,BOUGAINVILLA APARTMENTS,10,LORONG 19 GEYLANG,BOUGAINVILLA APARTMENTS,10 LORONG 19 GEYLANG BOUGAINVILLA APARTMENTS SINGAPORE 388492,388492,33134.9216119433,32860.5098922681,1.31345286890954,103.879458401694
FUYUEN COURT SIMS AVENUE,FUYUEN COURT,520,SIMS AVENUE,FUYUEN COURT,520 SIMS AVENUE FUYUEN COURT SINGAPORE 387580,387580,34196.5836112369,33153.3366229702,1.31610089372943,103.888998018255
NASSIM LODGE NASSIM ROAD,NASSIM LODGE,7,NASSIM ROAD,NASSIM LODGE,7 NASSIM ROAD NASSIM LODGE SINGAPORE 258374,258374,27152.3848927869,32175.3379034493,1.30725683177633,103.82570235412
THE HUNTINGTON MOULMEIN ROAD,THE HUNTINGTON,190,MOULMEIN ROAD,THE HUNTINGTON,190 MOULMEIN ROAD THE HUNTINGTON SINGAPORE 308095,308095,29335.4967250545,33451.971961353,1.31880224228412,103.845318707665
THE ESTIVA PASIR PANJANG ROAD,THE ESTIVA,313,PASIR PANJANG ROAD,THE ESTIVA,313 PASIR PANJANG ROAD THE ESTIVA SINGAPORE 117482,117482,21881.714405329,30027.8266380019,1.28783491011902,103.778343299539
NEWTON SUITES NEWTON ROAD,SUITES @ NEWTON,1,SURREY ROAD,SUITES @ NEWTON,1 SURREY ROAD SUITES @ NEWTON SINGAPORE 307740,307740,28929.6362976516,33186.3820271399,1.31640035574617,103.841671833933
RICHMOND PARK BIDEFORD ROAD,RICHMOND PARK,3,BIDEFORD ROAD,RICHMOND PARK,3 BIDEFORD ROAD RICHMOND PARK SINGAPORE 229920,229920,28343.8134566126,31921.673433749,1.30496278948447,103.836407903907
THE ARTE JALAN RAJAH,,,,,,,,,,
PASIR VIEW PARK PASIR PANJANG ROAD,PASIR VIEW PARK,200,PASIR PANJANG ROAD,PASIR VIEW PARK,200 PASIR PANJANG ROAD PASIR VIEW PARK SINGAPORE 118571,118571,22906.7626473149,29029.8393960558,1.27880964969521,103.787553932401
LE NOUVEL ARDMORE ARDMORE PARK,LE NOUVEL ARDMORE,1A,ARDMORE PARK,LE NOUVEL ARDMORE,1A ARDMORE PARK LE NOUVEL ARDMORE SINGAPORE 259945,259945,27398.4548832299,32525.5450129434,1.31042398715597,103.827913403265
HOCK MANSION WILKIE TERRACE,HOCK MANSION,1,WILKIE TERRACE,HOCK MANSION,1 WILKIE TERRACE HOCK MANSION SINGAPORE 228022,228022,29695.5969855618,31643.2547475845,1.30244482459515,103.848554295862
MERA EAST CHANGI ROAD,MERA EAST,336,CHANGI ROAD,MERA EAST,336 CHANGI ROAD MERA EAST SINGAPORE 419809,419809,36456.8910302483,33344.1542554833,1.3178260401216,103.909308065962
CRYSTAL DEW GEYLANG EAST AVENUE 1,CRYSTAL DEW,10,GEYLANG EAST AVENUE 1,CRYSTAL DEW,10 GEYLANG EAST AVENUE 1 CRYSTAL DEW SINGAPORE 389781,389781,33785.6827473091,33143.7845618632,1.316014588469,103.885305865351
THE NASSIM NASSIM HILL,THE LOFT,22,NASSIM HILL,THE LOFT,22 NASSIM HILL THE LOFT SINGAPORE 258468,258468,26753.5659788484,32161.8468274791,1.30713480971069,103.822118776986
PARC ASTON LEICESTER ROAD,PARC ASTON,2,LEICESTER ROAD,PARC ASTON,2 LEICESTER ROAD PARC ASTON SINGAPORE 358831,358831,31814.9459806504,34704.1960405745,1.33012670355272,103.867597994875
MINBU VILLA MINBU ROAD,MINBU VILLA,56,MINBU ROAD,MINBU VILLA,56 MINBU ROAD MINBU VILLA SINGAPORE 308185,308185,29640.4880676083,34224.3100831658,1.32578698013765,103.848059253669
SUNFLOWER MANSIONS LORONG 26 GEYLANG,SUNFLOWER MANSIONS,17,LORONG 26 GEYLANG,SUNFLOWER MANSIONS,17 LORONG 26 GEYLANG SUNFLOWER MANSIONS SINGAPORE 398489,398489,33757.4807350887,32708.8829423916,1.31208149865107,103.885052375181
CALIN MANSIONS LORONG 33 GEYLANG,CALIN MANSIONS,30,LORONG 33 GEYLANG,CALIN MANSIONS,30 LORONG 33 GEYLANG CALIN MANSIONS SINGAPORE 387987,387987,34082.7851333907,33089.6506967377,1.31552496371882,103.887975469134
GOLD COAST CONDOMINIUM PASIR PANJANG ROAD,GOLD COAST CONDOMINIUM,360,PASIR PANJANG ROAD,GOLD COAST CONDOMINIUM,360 PASIR PANJANG ROAD GOLD COAST CONDOMINIUM SINGAPORE 118699,118699,21465.7954123821,30327.716190828,1.29054692058657,103.774606037683
PALMERA EAST LORONG MELAYU,PALMERA EAST,29,LORONG MELAYU,PALMERA EAST,29 LORONG MELAYU PALMERA EAST SINGAPORE 416914,416914,36544.1256899564,33682.0718976911,1.32088202092246,103.910092007142
LE WILKIE WILKIE ROAD,LE WILKIE,68,WILKIE ROAD,LE WILKIE,68 WILKIE ROAD LE WILKIE SINGAPORE 228070,228070,29623.1201774795,31687.537624998,1.30284530720385,103.847903060812
GUILIN MANSIONS LORONG 37 GEYLANG,GUILIN MANSIONS,8,LORONG 37 GEYLANG,GUILIN MANSIONS,8 LORONG 37 GEYLANG GUILIN MANSIONS SINGAPORE 387906,387906,34303.5888033528,33118.7158005144,1.31578777361004,103.889959506676
URBAN RESORT CONDOMINIUM CAIRNHILL ROAD,URBAN RESORT CONDOMINIUM,32,CAIRNHILL ROAD,URBAN RESORT CONDOMINIUM,32 CAIRNHILL ROAD URBAN RESORT CONDOMINIUM SINGAPORE 229657,229657,28489.1485704454,31839.9101661164,1.30422334935226,103.837713806599
KELLOCK LODGE KELLOCK ROAD,KELLOCK LODGE,3,KELLOCK ROAD,KELLOCK LODGE,3 KELLOCK ROAD KELLOCK LODGE SINGAPORE 248899,248899,27597.2345996639,30808.051900208,1.29489158756341,103.829699558094
PADDY GREEN LORONG 12 GEYLANG,PADDY GREEN,1,LORONG 12 GEYLANG,PADDY GREEN,1 LORONG 12 GEYLANG PADDY GREEN SINGAPORE 398982,398982,33017.0579017401,32708.5489049237,1.3120786072378,103.878399313302
SALLIM LODGE SALLIM ROAD,SALLIM LODGE,20,SALLIM ROAD,SALLIM LODGE,20 SALLIM ROAD SALLIM LODGE SINGAPORE 387635,387635,33486.9576038169,34220.1945756879,1.3257493113403,103.882621861308
BANYAN CONDOMINIUM CHWEE CHIAN ROAD,BANYAN CONDOMINIUM,1,CHWEE CHIAN ROAD,BANYAN CONDOMINIUM,1 CHWEE CHIAN ROAD BANYAN CONDOMINIUM SINGAPORE 119744,119744,22987.9054212803,28935.0911028739,1.27795279258227,103.788283045426
ALEGRIA THOMSON ROAD,ALEGRIA,323C,THOMSON ROAD,ALEGRIA,323C THOMSON ROAD ALEGRIA SINGAPORE 307669,307669,28856.8758785613,34060.2162956204,1.32430300605838,103.841018068843
R66 APARTMENTS RANGOON ROAD,R66 APARTMENTS,60,RANGOON ROAD,R66 APARTMENTS,60 RANGOON ROAD R66 APARTMENTS SINGAPORE 218350,218350,30344.7313378751,32925.9703698494,1.31404520941052,103.854387162231
RESIDENTIAL APARTMENTS KIM KEAT CLOSE,,,,,,,,,,
HOLLAND COURT HOLLAND ROAD,HOLLAND COURT,144,HOLLAND ROAD,HOLLAND COURT,144 HOLLAND ROAD HOLLAND COURT SINGAPORE 278576,278576,24073.7499050926,32844.4291178789,1.31330761763,103.798039271294
KIM KEAT GARDENS KIM KEAT ROAD,KIM KEAT GARDENS,6,KIM KEAT ROAD,KIM KEAT GARDENS,6 KIM KEAT ROAD KIM KEAT GARDENS SINGAPORE 328847,328847,30151.0748409014,33981.1038980018,1.32358747782594,103.852647135431
HONG BUILDING RANGOON ROAD,HONG BUILDING,204,RANGOON ROAD,HONG BUILDING,204 RANGOON ROAD HONG BUILDING SINGAPORE 218451,218451,30186.7535899235,33312.8567365669,1.31754408452231,103.852967680614
NADIA MANSIONS AH HOOD ROAD,NADIA MANSIONS,30,AH HOOD ROAD,NADIA MANSIONS,30 AH HOOD ROAD NADIA MANSIONS SINGAPORE 329976,329976,29616.2026416762,34470.1527307816,1.32801029525715,103.847841048909
GOLDHILL TOWERS GOLDHILL AVENUE,GOLDHILL TOWERS,38,GOLDHILL AVENUE,GOLDHILL TOWERS,38 GOLDHILL AVENUE GOLDHILL TOWERS SINGAPORE 309021,309021,28021.5351302503,33654.5459511541,1.32063427888985,103.833512083526
RESIDENTIAL APARTMENTS SIMS AVENUE,,,,,,,,,,
BALMY COURT LORONG 27A GEYLANG,BALMY COURT,6,LORONG 27A GEYLANG,BALMY COURT,6 LORONG 27A GEYLANG BALMY COURT SINGAPORE 388105,388105,33746.0356234778,32938.5304934438,1.31415835134435,103.884949577853
RESIDENTIAL APARTMENTS BUKIT TIMAH ROAD,,,,,,,,,,
THE SPRINGS MOULMEIN RISE,THE SPRINGS,3,MOULMEIN RISE,THE SPRINGS,3 MOULMEIN RISE THE SPRINGS SINGAPORE 308144,308144,29484.3218584815,33486.8411023486,1.31911757962448,103.846655980088
THE DRAYCOTT DRAYCOTT PARK,THE DRAYCOTT,34,DRAYCOTT PARK,THE DRAYCOTT,34 DRAYCOTT PARK THE DRAYCOTT SINGAPORE 259388,259388,27794.9668017169,32586.754261408,1.31097754721533,103.831476255591
SETIA RESIDENCES EVELYN ROAD,SETIA RESIDENCES,11,EVELYN ROAD,SETIA RESIDENCES,11 EVELYN ROAD SETIA RESIDENCES SINGAPORE 309304,309304,28737.7681542281,33131.7914786749,1.31590666330907,103.839947799817
TWENTYONE ANGULLIA PARK ANGULLIA PARK,TWENTYONE ANGULLIA PARK,21,ANGULLIA PARK,TWENTYONE ANGULLIA PARK,21 ANGULLIA PARK TWENTYONE ANGULLIA PARK SINGAPORE 239974,239974,27634.3978116792,31789.4000748061,1.30376655553905,103.830033474096
HILLS APARTMENT GOLDHILL AVENUE,HILLS APARTMENT,46,GOLDHILL AVENUE,HILLS APARTMENT,46 GOLDHILL AVENUE HILLS APARTMENT SINGAPORE 309029,309029,28060.1709099421,33720.3877750635,1.32122972902134,103.833859246363
THE PROMONT CAIRNHILL CIRCLE,THE PROMONT,63,CAIRNHILL CIRCLE,THE PROMONT,63 CAIRNHILL CIRCLE THE PROMONT SINGAPORE 229790,229790,28517.2293593911,32225.0510690175,1.30770642748752,103.837966131924
YONG SIAK VIEW YONG SIAK STREET,YONG SIAK VIEW,19,YONG SIAK STREET,YONG SIAK VIEW,19 YONG SIAK STREET YONG SIAK VIEW SINGAPORE 168650,168650,27643.4250562154,29463.6085994523,1.28273291506553,103.830114614569
LE MARICAN LORONG MARICAN,LE MARICAN,95,LORONG MARICAN,LE MARICAN,95 LORONG MARICAN LE MARICAN SINGAPORE 417301,417301,36246.6233730065,34253.2361963596,1.32604750612789,103.907418948375
PRIME RESIDENCE LORONG 22 GEYLANG,PRIME RESIDENCE,41,LORONG 22 GEYLANG,PRIME RESIDENCE,41 LORONG 22 GEYLANG PRIME RESIDENCE SINGAPORE 398697,398697,33469.7032186268,32610.2792345155,1.31118981428433,103.882466535926
THE BLISS RACE COURSE ROAD,THE BLISS,128,RACE COURSE ROAD,THE BLISS,128 RACE COURSE ROAD THE BLISS SINGAPORE 218586,218586,30100.6823104378,32442.8680154197,1.30967622003781,103.8521942271
RESIDENTIAL APARTMENTS JOO AVENUE,,,,,,,,,,
WHARTON VALE SOPHIA ROAD,WHARTON VALE,68,SOPHIA ROAD,WHARTON VALE,68 SOPHIA ROAD WHARTON VALE SINGAPORE 228187,228187,29670.7573831165,31592.8231714219,1.30198874054112,103.84833109795
ARIVA ON SHAN SERVICED RESIDENCE SHAN ROAD,,,,,,,,,,
ROSEVALE LINCOLN ROAD,ROSEVALE,32,LINCOLN ROAD,ROSEVALE,32 LINCOLN ROAD ROSEVALE SINGAPORE 308362,308362,29121.0206678919,33138.5994141083,1.31596822029115,103.84339151806
THE SPINNAKER SUFFOLK ROAD,THE SPINNAKER,13,SUFFOLK ROAD,THE SPINNAKER,13 SUFFOLK ROAD THE SPINNAKER SINGAPORE 307788,307788,29187.0640765717,32930.1891214196,1.31408342873893,103.843984943567
RANGOON VIEW RANGOON ROAD,RANGOON VIEW,223,RANGOON ROAD,RANGOON VIEW,223 RANGOON ROAD RANGOON VIEW SINGAPORE 218460,218460,30104.1105530774,33343.7976986337,1.31782390941569,103.852225092717
JIA WILKIE ROAD,JIA,65,WILKIE ROAD,JIA,65 WILKIE ROAD JIA SINGAPORE 228068,228068,29581.8769017942,31643.3738521002,1.30244590773606,103.847532468776
ONE AKYAB AKYAB ROAD,ONE AKYAB,1,AKYAB ROAD,ONE AKYAB,1 AKYAB ROAD ONE AKYAB SINGAPORE 309972,309972,29595.9222753504,33886.0560728535,1.32272793298026,103.847658788312
MANDALAY TOWERS MANDALAY ROAD,MANDALAY TOWERS,35,MANDALAY ROAD,MANDALAY TOWERS,35 MANDALAY ROAD MANDALAY TOWERS SINGAPORE 308215,308215,29757.3239073521,33978.0821846519,1.32356017570747,103.849109072916
BUONA VISTA GARDENS ZEHNDER ROAD,BUONA VISTA GARDENS,2,ZEHNDER ROAD,BUONA VISTA GARDENS,2 ZEHNDER ROAD BUONA VISTA GARDENS SINGAPORE 117687,117687,22835.1528958939,29439.7895728815,1.28251708251467,103.786910425377
FONTANA HEIGHTS MOUNT SINAI RISE,FONTANA HEIGHTS,39,MOUNT SINAI RISE,FONTANA HEIGHTS,39 MOUNT SINAI RISE FONTANA HEIGHTS SINGAPORE 276957,276957,21725.8955213167,33072.4706799835,1.31536955463919,103.776942592447
RESIDENTIAL APARTMENTS NASSIM HILL,,,,,,,,,,
BAODE BUILDING LORONG 35 GEYLANG,BAODE BUILDING,8,LORONG 35 GEYLANG,BAODE BUILDING,8 LORONG 35 GEYLANG BAODE BUILDING SINGAPORE 387940,387940,34165.3741721539,33052.9817306269,1.31519332622797,103.888717565728
TIONG BAHRU ESTATE YONG SIAK STREET,TIONG BAHRU ESTATE,1,YONG SIAK STREET,TIONG BAHRU ESTATE,1 YONG SIAK STREET TIONG BAHRU ESTATE SINGAPORE 168641,168641,27690.0680191237,29409.3871387821,1.2822425556884,103.830533720291
ELIZABETH HEIGHTS CAIRNHILL ROAD,ELIZABETH HEIGHTS,57,CAIRNHILL ROAD,ELIZABETH HEIGHTS,57 CAIRNHILL ROAD ELIZABETH HEIGHTS SINGAPORE 229668,229668,28352.7148468718,32205.0541018229,1.30752558427329,103.836487890258
