QUERY,SEARCHVAL,BLK_NO,ROAD_NAME,BUILDING,ADDRESS,POSTAL,X,Y,LATITUDE,LONGITUDE
THE TRUMPS JALAN KEMBANGAN,THE TRUMPS,1,JALAN KEMBANGAN,THE TRUMPS,1 JALAN KEMBANGAN THE TRUMPS SINGAPORE 419154,419154,36921.9904419836,33587.4406810701,1.32002610262337,103.91348728953
PARC RIVIERA WEST COAST VALE,PARC RIVIERA,101,WEST COAST VALE,PARC RIVIERA,101 WEST COAST VALE PARC RIVIERA SINGAPORE 126753,126753,19024.3082316956,33674.9725421108,1.32081769238494,103.752667309254
D'LEEDON LEEDON HEIGHTS,D'LEEDON,1,LEEDON HEIGHTS,D'LEEDON,1 LEEDON HEIGHTS D'LEEDON SINGAPORE 267939,267939,24547.934373212,33152.1085903347,1.31609021863642,103.802300019532
368 THOMSON THOMSON ROAD,368 THOMSON,368,THOMSON ROAD,368 THOMSON,368 THOMSON ROAD 368 THOMSON SINGAPORE 298127,298127,28963.7693515504,34368.5353911072,1.3270913316471,103.841978573745
ONE LEICESTER LEICESTER ROAD,ONE LEICESTER,1,LEICESTER ROAD,ONE LEICESTER,1 LEICESTER ROAD ONE LEICESTER SINGAPORE 358828,358828,31788.1548196869,34627.2346674874,1.32943069562467,103.867357251861
ORCHARD BEL AIR ORCHARD BOULEVARD,ORCHARD BEL AIR,245,ORCHARD BOULEVARD,ORCHARD BEL AIR,245 ORCHARD BOULEVARD ORCHARD BEL AIR SINGAPORE 248648,248648,27071.2615811359,31629.2464523073,1.30231817080686,103.824973438871
CARIBBEAN AT KEPPEL BAY KEPPEL BAY DRIVE,CARIBBEAN AT KEPPEL BAY,2,KEPPEL BAY DRIVE,CARIBBEAN AT KEPPEL BAY,2 KEPPEL BAY DRIVE CARIBBEAN AT KEPPEL BAY SINGAPORE 098636,098636,26021.7114668665,27775.9428593945,1.26747019767944,103.815542991374
CORALS AT KEPPEL BAY KEPPEL BAY DRIVE,CORALS AT KEPPEL BAY,1,KEPPEL BAY DRIVE,CORALS AT KEPPEL BAY,1 KEPPEL BAY DRIVE CORALS AT KEPPEL BAY SINGAPORE 098012,098012,26123.1077897251,27490.6492547505,1.26489010829928,103.816454088109
THE SIERRA MOUNT SINAI DRIVE,THE SIERRA,80,MOUNT SINAI DRIVE,THE SIERRA,80 MOUNT SINAI DRIVE THE SIERRA SINGAPORE 277125,277125,22102.412318957,33374.9030763898,1.31810471986283,103.78032572661
VA RESIDENCES BOON TECK ROAD,VA RESIDENCES,9,BOON TECK ROAD,VA RESIDENCES,9 BOON TECK ROAD VA RESIDENCES SINGAPORE 329583,329583,29820.8707824666,34328.2166812532,1.32672666436714,103.84968009627
MARGARET VILLE MARGARET DRIVE,MARGARET VILLE,20,MARGARET DRIVE,MARGARET VILLE,20 MARGARET DRIVE MARGARET VILLE SINGAPORE 149312,149312,24604.3263509953,31319.5494068619,1.2995172080842,103.802806930224
D' IXORAS MINBU ROAD,D' IXORAS,23,MINBU ROAD,D' IXORAS,23 MINBU ROAD D' IXORAS SINGAPORE 308172,308172,29749.710873819,34039.2487552594,1.32411334495333,103.849040669227
WATERBANK AT DAKOTA DAKOTA CRESCENT,WATERBANK AT DAKOTA,70,DAKOTA CRESCENT,WATERBANK AT DAKOTA,70 DAKOTA CRESCENT WATERBANK AT DAKOTA SINGAPORE 399941,399941,34095.3144139107,32109.2049620729,1.30665815996221,103.888087858364
BOTANNIA WEST COAST PARK,BOTANNIA,29,WEST COAST PARK,BOTANNIA,29 WEST COAST PARK BOTANNIA SINGAPORE 127647,127647,19120.0706839403,33367.115305787,1.31803357100435,103.753527872969
THE LEGEND BUKIT TIMAH ROAD,THE LEGEND,361,BUKIT TIMAH ROAD,THE LEGEND,361 BUKIT TIMAH ROAD THE LEGEND SINGAPORE 259725,259725,27561.9551458824,33394.3415387478,1.31828107898793,103.829382520419
HORIZON RESIDENCES PASIR PANJANG HILL,HORIZON RESIDENCES,41,PASIR PANJANG HILL,HORIZON RESIDENCES,41 PASIR PANJANG HILL HORIZON RESIDENCES SINGAPORE 118862,118862,22520.4515538961,29402.4276818205,1.28217914161626,103.78408271893
TROPIKA EAST FOO KIM LIN ROAD,TROPIKA EAST,1,FOO KIM LIN ROAD,TROPIKA EAST,1 FOO KIM LIN ROAD TROPIKA EAST SINGAPORE 419684,419684,36184.9835624732,34579.3954835944,1.32899718944322,103.906865168799
GARDENVILLE WALSHE ROAD,GARDENVILLE,10,WALSHE ROAD,GARDENVILLE,10 WALSHE ROAD GARDENVILLE SINGAPORE 257654,257654,27330.5175160049,32750.8683890384,1.31246173086025,103.827302948052
THE SAIL @ MARINA BAY MARINA BOULEVARD,THE SAIL @ MARINA BAY,6,MARINA BOULEVARD,THE SAIL @ MARINA BAY,6 MARINA BOULEVARD THE SAIL @ MARINA BAY SINGAPORE 018985,018985,30152.3828112809,29246.5050088912,1.28076943504219,103.852658562152
EUHABITAT JALAN EUNOS,EUHABITAT,186,JALAN EUNOS,EUHABITAT,186 JALAN EUNOS EUHABITAT SINGAPORE 419537,419537,36156.7583952453,34497.757707024,1.32825889448877,103.906611528497
SPOTTISWOODE SUITES SPOTTISWOODE PARK ROAD,SPOTTISWOODE SUITES,16,SPOTTISWOODE PARK ROAD,SPOTTISWOODE SUITES,16 SPOTTISWOODE PARK ROAD SPOTTISWOODE SUITES SINGAPORE 088661,088661,28465.5867006639,28723.0007681884,1.27603511606189,103.837502046362
THE TRESOR DUCHESS ROAD,THE TRESOR,26,DUCHESS ROAD,THE TRESOR,26 DUCHESS ROAD THE TRESOR SINGAPORE 269029,269029,25060.8786894884,33985.1645598933,1.32362413503101,103.806909004363
HERITAGE VIEW DOVER RISE,HERITAGE VIEW,6,DOVER RISE,HERITAGE VIEW,6 DOVER RISE HERITAGE VIEW SINGAPORE 138678,138678,22495.5534737054,31783.8118785787,1.3037155308885,103.783858583197
KILLINEY 118 KILLINEY ROAD,KILLINEY 118,118,KILLINEY ROAD,KILLINEY 118,118 KILLINEY ROAD KILLINEY 118 SINGAPORE 239555,239555,28566.4137735525,31148.2267773021,1.29796800700412,103.838408057882
REGENCY SUITES KIM TIAN ROAD,REGENCY SUITES,38,KIM TIAN ROAD,REGENCY SUITES,38 KIM TIAN ROAD REGENCY SUITES SINGAPORE 169262,169262,27533.4061112283,29641.454312453,1.28434128785856,103.82912604887
THE PATERSON PATERSON ROAD,THE PATERSON EDGE,26,PATERSON ROAD,THE PATERSON EDGE,26 PATERSON ROAD THE PATERSON EDGE SINGAPORE 238518,238518,27594.5957763074,31659.6176801175,1.30259284877615,103.829675836055
ECHELON ALEXANDRA VIEW,ECHELON,5,ALEXANDRA VIEW,ECHELON,5 ALEXANDRA VIEW ECHELON SINGAPORE 158750,158750,26294.044502493,30373.7634495497,1.29096399148778,103.817989855708
NIN RESIDENCE PHENG GECK AVENUE,NIN RESIDENCE,81,PHENG GECK AVENUE,NIN RESIDENCE,81 PHENG GECK AVENUE NIN RESIDENCE SINGAPORE 348269,348269,32059.6465567052,34999.0754551273,1.33279345626326,103.869796804823
JERVOIS TREASURES JERVOIS ROAD,JERVOIS TREASURES,31,JERVOIS ROAD,JERVOIS TREASURES,31 JERVOIS ROAD JERVOIS TREASURES SINGAPORE 249080,249080,26910.8311276594,30579.024873089,1.29282033122383,103.823531934289
ONE DUSUN RESIDENCES JALAN DUSUN,ONE DUSUN RESIDENCES,1,JALAN DUSUN,ONE DUSUN RESIDENCES,1 JALAN DUSUN ONE DUSUN RESIDENCES SINGAPORE 329363,329363,29152.4788189977,34354.6110894848,1.32696539864482,103.84367423097
LUMIERE MISTRI ROAD,LUMIERE,2,MISTRI ROAD,LUMIERE,2 MISTRI ROAD LUMIERE SINGAPORE 079624,079624,29414.1345509551,28526.9923883434,1.27426245685335,103.846025087372
WOODSVILLE 28 WOODSVILLE CLOSE,WOODSVILLE 28,26,WOODSVILLE CLOSE,WOODSVILLE 28,26 WOODSVILLE CLOSE WOODSVILLE 28 SINGAPORE 357774,357774,31898.8743474251,34694.1654123776,1.33003597946809,103.868352136654
KERRISDALE STURDEE ROAD,KERRISDALE,30,STURDEE ROAD,KERRISDALE,30 STURDEE ROAD KERRISDALE SINGAPORE 207852,207852,30708.5465999004,32823.9673555251,1.3131227003568,103.857656215109
CENTRA SUITES LORONG 25A GEYLANG,CENTRA SUITES,38,LORONG 25A GEYLANG,CENTRA SUITES,38 LORONG 25A GEYLANG CENTRA SUITES SINGAPORE 388242,388242,33561.1334143626,32993.0751556456,1.31465166781856,103.883288149427
76 SHENTON SHENTON WAY,76 SHENTON,76,SHENTON WAY,76 SHENTON,76 SHENTON WAY 76 SHENTON SINGAPORE 079119,079119,29364.6884398069,28438.9366187733,1.2734661134853,103.845580792511
QUEENS STIRLING ROAD,QUEENS,10,STIRLING ROAD,QUEENS,10 STIRLING ROAD QUEENS SINGAPORE 148954,148954,24922.4587808242,30598.4692679718,1.29299604681606,103.805665563173
CAPE ROYALE COVE WAY,CAPE ROYALE,11,COVE WAY,CAPE ROYALE,11 COVE WAY CAPE ROYALE SINGAPORE 098202,098202,28754.7587236715,24880.5454325154,1.24128528590103,103.8401002733
EURO-ASIA COURT RIVER VALLEY CLOSE,EURO-ASIA COURT,3,RIVER VALLEY CLOSE,EURO-ASIA COURT,3 RIVER VALLEY CLOSE EURO-ASIA COURT SINGAPORE 238429,238429,28486.8691188591,30794.7981857657,1.29477172447814,103.83769330846
VERDURE HOLLAND ROAD,VERDURE,55,HOLLAND ROAD,VERDURE,55 HOLLAND ROAD VERDURE SINGAPORE 258865,258865,25104.6281542256,32368.0326049738,1.30899937042874,103.807302268297
SIMS GREEN LORONG 27A GEYLANG,SIMS GREEN,7,LORONG 27A GEYLANG,SIMS GREEN,7 LORONG 27A GEYLANG SIMS GREEN SINGAPORE 388133,388133,33710.4345723698,32966.3985287324,1.31441038654771,103.884629689864
THE FORESTA @ MOUNT FABER WISHART ROAD,THE FORESTA @ MOUNT FABER,100,WISHART ROAD,THE FORESTA @ MOUNT FABER,100 WISHART ROAD THE FORESTA @ MOUNT FABER SINGAPORE 098748,098748,25846.3535097167,28094.405966945,1.27035025509729,103.813967319772
ST MARTIN RESIDENCE ST. MARTIN'S DRIVE,SAINT MARTIN RESIDENCE,2,SAINT MARTIN'S DRIVE,SAINT MARTIN RESIDENCE,2 SAINT MARTIN'S DRIVE SAINT MARTIN RESIDENCE SINGAPORE 257989,257989,27020.0970052117,32062.883384617,1.30623982883747,103.824513688059
SKYSUITES17 JALAN RAJAH,,,,,,,,,,
CONCOURSE SKYLINE BEACH ROAD,CONCOURSE SKYLINE,298,BEACH ROAD,CONCOURSE SKYLINE,298 BEACH ROAD CONCOURSE SKYLINE SINGAPORE 199554,199554,31177.0260071084,31402.4437890444,1.30026689906653,103.861865589801
ASCENTIA SKY ALEXANDRA VIEW,ASCENTIA SKY,1,ALEXANDRA VIEW,ASCENTIA SKY,1 ALEXANDRA VIEW ASCENTIA SKY SINGAPORE 158748,158748,26183.8948603524,30371.6344903782,1.29094473172583,103.817000115258
ECOVILLE MARTABAN ROAD,ECOVILLE,10,MARTABAN ROAD,ECOVILLE,10 MARTABAN ROAD ECOVILLE SINGAPORE 328668,328668,29955.5608280338,34007.9462421257,1.32383024362223,103.850890339366
MARTIN MODERN MARTIN PLACE,MARTIN MODERN,8,MARTIN PLACE,MARTIN MODERN,8 MARTIN PLACE MARTIN MODERN SINGAPORE 237992,237992,28532.6770486329,30653.8086463548,1.2934966639073,103.8381049101
POLLEN & BLEU FARRER DRIVE,,,,,,,,,,
8 @ MOUNT SOPHIA MOUNT SOPHIA,CITADINES MOUNT SOPHIA SINGAPORE,8,WILKIE ROAD,CITADINES MOUNT SOPHIA SINGAPORE,8 WILKIE ROAD CITADINES MOUNT SOPHIA SINGAPORE SINGAPORE 228095,228095,29786.030880345,31603.5766898729,1.30208598515708,103.849366883599
NOVA 48 PROME ROAD,NOVA 48,8,PROME ROAD,NOVA 48,8 PROME ROAD NOVA 48 SINGAPORE 328316,328316,29756.2057172293,34139.7272923142,1.32502203689022,103.849099034618
LEONIE GARDENS LEONIE HILL,LEONIE GARDENS,23,LEONIE HILL,LEONIE GARDENS,23 LEONIE HILL LEONIE GARDENS SINGAPORE 239224,239224,27874.4360891311,31193.7760066185,1.29837994307162,103.832190331692
THE ORCHARD RESIDENCES ORCHARD BOULEVARD,THE ORCHARD RESIDENCES,238,ORCHARD BOULEVARD,THE ORCHARD RESIDENCES,238 ORCHARD BOULEVARD THE ORCHARD RESIDENCES SINGAPORE 237973,237973,27820.735479923,31797.1799454633,1.30383691559687,103.831707804361
D'CHATEAU @ SHELFORD SHELFORD ROAD,D'CHATEAU @ SHELFORD,25,SHELFORD ROAD,D'CHATEAU @ SHELFORD,25 SHELFORD ROAD D'CHATEAU @ SHELFORD SINGAPORE 288415,288415,25626.1535649579,34479.6513688955,1.32809614767202,103.81198826246
VALLEY PARK RIVER VALLEY ROAD,UE SQUARE (PARK WING),205,RIVER VALLEY ROAD,UE SQUARE (PARK WING),205 RIVER VALLEY ROAD UE SQUARE (PARK WING) SINGAPORE 238274,238274,28993.7696754877,30569.0842013396,1.29273043457202,103.842248021629
THE TRIZON RIDGEWOOD CLOSE,THE TRIZON,2,RIDGEWOOD CLOSE,THE TRIZON,2 RIDGEWOOD CLOSE THE TRIZON SINGAPORE 276693,276693,21891.6091302782,33206.2524438947,1.31657946252272,103.778431585714
PATERSON RESIDENCE PATERSON ROAD,FRASER RESIDENCE ORCHARD SINGAPORE,31,PATERSON ROAD,FRASER RESIDENCE ORCHARD SINGAPORE,31 PATERSON ROAD FRASER RESIDENCE ORCHARD SINGAPORE SINGAPORE 238522,238522,27633.8685759846,31557.9117460549,1.30167305661383,103.830028721396
WATERFRONT @ FABER FABER WALK,WATERFRONT @ FABER,18,FABER WALK,WATERFRONT @ FABER,18 FABER WALK WATERFRONT @ FABER SINGAPORE 128978,128978,19323.9203481833,33971.1264506541,1.32349608758894,103.755359395053
ASTORIA PARK LORONG MYDIN,ASTORIA PARK,28,LORONG MYDIN,ASTORIA PARK,28 LORONG MYDIN ASTORIA PARK SINGAPORE 416883,416883,36735.1355847027,33710.9665019158,1.32114327931913,103.911808337852
THE SORRENTO WEST COAST ROAD,THE SORRENTO,55,WEST COAST ROAD,THE SORRENTO,55 WEST COAST ROAD THE SORRENTO SINGAPORE 127365,127365,20521.6404453712,30904.522199519,1.29576313642746,103.766122279701
TANGLIN VIEW PRINCE CHARLES CRESCENT,TANGLIN VIEW,150,PRINCE CHARLES CRESCENT,TANGLIN VIEW,150 PRINCE CHARLES CRESCENT TANGLIN VIEW SINGAPORE 159012,159012,26336.0061282357,30469.3870020173,1.29182877953015,103.818366893396
ONE DRAYCOTT DRAYCOTT PARK,ONE DRAYCOTT,1,DRAYCOTT PARK,ONE DRAYCOTT,1 DRAYCOTT PARK ONE DRAYCOTT SINGAPORE 259385,259385,27710.321416676,32488.0176165476,1.31008460714385,103.830715676333
ONE-NORTH RESIDENCES ONE-NORTH GATEWAY,ONE-NORTH RESIDENCES,7,ONE-NORTH GATEWAY,ONE-NORTH RESIDENCES,7 ONE-NORTH GATEWAY ONE-NORTH RESIDENCES SINGAPORE 138642,138642,23168.743396882,31616.70648719,1.30220440131525,103.789907530412
HIGHLINE RESIDENCES KIM TIAN ROAD,HIGHLINE RESIDENCES,1,KIM TIAN ROAD,HIGHLINE RESIDENCES,1 KIM TIAN ROAD HIGHLINE RESIDENCES SINGAPORE 169280,169280,27603.5858517587,29605.2518667746,1.28401388660814,103.829756642021
TRE RESIDENCES GEYLANG EAST AVENUE 1,TRE RESIDENCES,7,GEYLANG EAST AVENUE 1,TRE RESIDENCES,7 GEYLANG EAST AVENUE 1 TRE RESIDENCES SINGAPORE 389782,389782,33714.7937371163,33276.5201431867,1.31721501497667,103.884668916461
WING FONG MANSIONS LORONG 14 GEYLANG,WING FONG MANSIONS,12,LORONG 14 GEYLANG,WING FONG MANSIONS,12 LORONG 14 GEYLANG WING FONG MANSIONS SINGAPORE 398924,398924,33092.6962612588,32542.3466496319,1.31057552074486,103.879078933752
FERRELL RESIDENCES BUKIT TIMAH ROAD,FERRELL RESIDENCES,327,BUKIT TIMAH ROAD,FERRELL RESIDENCES,327 BUKIT TIMAH ROAD FERRELL RESIDENCES SINGAPORE 259715,259715,27891.1187121086,33330.0041244347,1.3176992370965,103.832340224879
ALEX RESIDENCES ALEXANDRA VIEW,ALEX RESIDENCES,28,ALEXANDRA VIEW,ALEX RESIDENCES,28 ALEXANDRA VIEW ALEX RESIDENCES SINGAPORE 158744,158744,26406.5516573498,30330.1968942378,1.29056999681587,103.819000781728
WATERSCAPE AT CAVENAGH CAVENAGH ROAD,WATERSCAPE AT CAVENAGH,65,CAVENAGH ROAD,WATERSCAPE AT CAVENAGH,65 CAVENAGH ROAD WATERSCAPE AT CAVENAGH SINGAPORE 229619,229619,28833.0605446845,31810.3242714126,1.30395577762362,103.840804014831
STURDEE RESIDENCES BEATTY ROAD,STURDEE RESIDENCES,10,BEATTY ROAD,STURDEE RESIDENCES,10 BEATTY ROAD STURDEE RESIDENCES SINGAPORE 209955,209955,30863.3355249632,32801.2183627151,1.31291695250751,103.859047068258
DUCHESS RESIDENCES DUCHESS AVENUE,DUCHESS RESIDENCES,102,DUCHESS AVENUE,DUCHESS RESIDENCES,102 DUCHESS AVENUE DUCHESS RESIDENCES SINGAPORE 266310,266310,24461.1842433875,34084.686477324,1.3245241122412,103.801520418513
REFLECTIONS AT KEPPEL BAY KEPPEL BAY VIEW,REFLECTIONS AT KEPPEL BAY,1,KEPPEL BAY VIEW,REFLECTIONS AT KEPPEL BAY,1 KEPPEL BAY VIEW REFLECTIONS AT KEPPEL BAY SINGAPORE 098402,098402,25892.2692540484,27852.4581126701,1.26816216653267,103.814379904552
VIDA PECK HAY ROAD,VIDA,5,PECK HAY ROAD,VIDA,5 PECK HAY ROAD VIDA SINGAPORE 228307,228307,28641.3470101217,32333.3137747869,1.30868551490343,103.839081390501
PARK PLACE RESIDENCES AT PLQ PAYA LEBAR ROAD,PARK PLACE RESIDENCES AT PLQ,2,PAYA LEBAR ROAD,PARK PLACE RESIDENCES AT PLQ,2 PAYA LEBAR ROAD PARK PLACE RESIDENCES AT PLQ SINGAPORE 409053,409053,34613.7707721666,33124.1389756929,1.31583675363618,103.892746648427
CHANCERY PARK CHANCERY LANE,CHANCERY PARK,9,CHANCERY LANE,CHANCERY PARK,9 CHANCERY LANE CHANCERY PARK SINGAPORE 309499,309499,28393.3941089483,33473.19535698,1.31899420570811,103.836853428868
TREVISTA LORONG 3 TOA PAYOH,TREVISTA,21,LORONG 3 TOA PAYOH,TREVISTA,21 LORONG 3 TOA PAYOH TREVISTA SINGAPORE 319581,319581,29471.2359497417,35510.7108324487,1.33742074109903,103.846538493576
YONG AN PARK RIVER VALLEY ROAD,YONG AN PARK,325,RIVER VALLEY ROAD,YONG AN PARK,325 RIVER VALLEY ROAD YONG AN PARK SINGAPORE 238357,238357,28183.7211873177,30875.0444523208,1.29549744673762,103.834969393898
SOLEIL @ SINARAN SINARAN DRIVE,SOLEIL @ SINARAN,2,SINARAN DRIVE,SOLEIL @ SINARAN,2 SINARAN DRIVE SOLEIL @ SINARAN SINGAPORE 307467,307467,29330.2690810505,33540.2060093489,1.31960020004528,103.845271738384
THE INTERLACE DEPOT ROAD,THE INTERLACE,180,DEPOT ROAD,THE INTERLACE,180 DEPOT ROAD THE INTERLACE SINGAPORE 109684,109684,24628.4343157392,29404.8510879371,1.28220135422008,103.803023756097
2 RVG RIVER VALLEY GROVE,2 RVG,2,RIVER VALLEY GROVE,2 RVG,2 RIVER VALLEY GROVE 2 RVG SINGAPORE 238405,238405,28124.7525263485,30980.3680763338,1.29644995684098,103.834439535286
REGENT PARK JALAN LEMPENG,REGENT PARK,22,JALAN LEMPENG,REGENT PARK,22 JALAN LEMPENG REGENT PARK SINGAPORE 128803,128803,20012.3035279298,33281.5020414311,1.31725956103263,103.761545059068
PATERSON SUITES PATERSON ROAD,PATERSON SUITES,55,PATERSON ROAD,PATERSON SUITES,55 PATERSON ROAD PATERSON SUITES SINGAPORE 238550,238550,27717.3181940606,31536.3799802102,1.30147833178138,103.830778554467
EMERALD PARK INDUS ROAD,EMERALD PARK TOWER 2,2,INDUS ROAD,EMERALD PARK TOWER 2,2 INDUS ROAD EMERALD PARK TOWER 2 SINGAPORE 169586,169586,27640.1749709276,30209.8859570157,1.28948198551176,103.830085402755
LUMA RIVER VALLEY GROVE,LUMA,6,RIVER VALLEY GROVE,LUMA,6 RIVER VALLEY GROVE LUMA SINGAPORE 238403,238403,28142.2919148728,31018.9754646569,1.29679910840731,103.83459713454
THE CENTREN LORONG 27 GEYLANG,THE CENTREN,1,LORONG 27 GEYLANG,THE CENTREN,1 LORONG 27 GEYLANG THE CENTREN SINGAPORE 388153,388153,33591.4952288289,32914.3644141722,1.3139398304258,103.883560951253
SUITES 28 LORONG 30 GEYLANG,SUITES 28,28,LORONG 30 GEYLANG,SUITES 28,28 LORONG 30 GEYLANG SUITES 28 SINGAPORE 398361,398361,33856.3872741414,32775.5719671641,1.31268459175571,103.885941111431
GLENTREES MOUNT SINAI LANE,GLENTREES,11A,MOUNT SINAI LANE,GLENTREES,11A MOUNT SINAI LANE GLENTREES SINGAPORE 277050,277050,22612.3835625323,33168.5677750558,1.31623879085761,103.784908114868
MARINA BAY RESIDENCES MARINA BOULEVARD,MARINA BAY RESIDENCES,18,MARINA BOULEVARD,MARINA BAY RESIDENCES,18 MARINA BOULEVARD MARINA BAY RESIDENCES SINGAPORE 018980,018980,30411.5427663736,29120.0497012436,1.279625798918,103.854987203774
THE ASTON KAY POH ROAD,THE ASTON,2,KAY POH ROAD,THE ASTON,2 KAY POH ROAD THE ASTON SINGAPORE 248973,248973,27613.9570553079,30923.5882748738,1.29593645811863,103.829849815157
SIMS URBAN OASIS SIMS DRIVE,SIMS URBAN OASIS,2,SIMS DRIVE,SIMS URBAN OASIS,2 SIMS DRIVE SIMS URBAN OASIS SINGAPORE 387386,387386,33348.8567197006,33494.8509794157,1.31918958720539,103.881380824314
LEONIE TOWERS LEONIE HILL,HORIZON TOWERS,15,LEONIE HILL ROAD,HORIZON TOWERS,15 LEONIE HILL ROAD HORIZON TOWERS SINGAPORE 239194,239194,28006.5738172391,31183.9053749833,1.29829067681172,103.833377647901
THE MEZZO BALESTIER ROAD,THE MEZZO,205,BALESTIER ROAD,THE MEZZO,205 BALESTIER ROAD THE MEZZO SINGAPORE 329682,329682,30128.8407670297,33642.4183267783,1.32052452699851,103.852447326986
SOPHIA HILLS MOUNT SOPHIA,SOPHIA HILLS,5,MOUNT SOPHIA,SOPHIA HILLS,5 MOUNT SOPHIA SOPHIA HILLS SINGAPORE 228453,228453,29648.300355277,31449.2792865969,1.30069058142746,103.848129303731
GISBORNE LIGHT EWE BOON ROAD,GISBORNE LIGHT,27,EWE BOON ROAD,GISBORNE LIGHT,27 EWE BOON ROAD GISBORNE LIGHT SINGAPORE 259330,259330,27678.3123579994,33169.6965589728,1.31624947059146,103.83042805227
THE LEGACY BUKIT TIMAH ROAD,THE LEGACY,455,BUKIT TIMAH ROAD,THE LEGACY,455 BUKIT TIMAH ROAD THE LEGACY SINGAPORE 259750,259750,26811.5486299805,33699.9731702283,1.32104508345244,103.822639719508
REZI 3TWO LORONG 32 GEYLANG,REZI 3TWO,48,LORONG 32 GEYLANG,REZI 3TWO,48 LORONG 32 GEYLANG REZI 3TWO SINGAPORE 398308,398308,33953.5634833695,32713.9771348555,1.31212753143258,103.886814275583
SKY GREEN MACPHERSON ROAD,SKY GREEN,568,MACPHERSON ROAD,SKY GREEN,568 MACPHERSON ROAD SKY GREEN SINGAPORE 368236,368236,33935.7145139072,34977.4664151203,1.33259772264628,103.886654330662
WESTCOVE CONDOMINIUM WEST COAST CRESCENT,WESTCOVE CONDOMINIUM,10,WEST COAST CRESCENT,WESTCOVE CONDOMINIUM,10 WEST COAST CRESCENT WESTCOVE CONDOMINIUM SINGAPORE 128041,128041,20544.9508487433,31098.8855749853,1.29752089480499,103.766331687461
RIVERBAY MAR THOMA ROAD,RIVERBAY,23,MAR THOMA ROAD,RIVERBAY,23 MAR THOMA ROAD RIVERBAY SINGAPORE 328704,328704,31252.1037733005,34467.6268372722,1.32798732117053,103.862540519298
EIGHT RIVERSUITES WHAMPOA EAST,EIGHT RIVERSUITES,2,WHAMPOA EAST,EIGHT RIVERSUITES,2 WHAMPOA EAST EIGHT RIVERSUITES SINGAPORE 338517,338517,31497.3523512008,33785.7240631077,1.3218204074661,103.864744134712
EMERALD GARDEN CLUB STREET,EMERALD GARDEN,33,CLUB STREET,EMERALD GARDEN,33 CLUB STREET EMERALD GARDEN SINGAPORE 069415,069415,29463.9317404469,29332.6599188168,1.28154862924483,103.846472570061
REZI 35 LORONG 35 GEYLANG,REZI 35,20,LORONG 35 GEYLANG,REZI 35,20 LORONG 35 GEYLANG REZI 35 SINGAPORE 387949,387949,34178.6793724364,33111.3526594546,1.31572120937619,103.888837131268
# 1 SUITES LORONG 20 GEYLANG,# 1 SUITES,1,LORONG 20 GEYLANG,# 1 SUITES,1 LORONG 20 GEYLANG # 1 SUITES SINGAPORE 398721,398721,33362.595902334,32743.0199916642,1.31239029325188,103.881504147527
HILLTOPS CAIRNHILL CIRCLE,HILLTOPS,101,CAIRNHILL CIRCLE,HILLTOPS,101 CAIRNHILL CIRCLE HILLTOPS SINGAPORE 229809,229809,28580.6810114291,32175.8816072401,1.30726175508578,103.838536274396
SPOTTISWOODE 18 SPOTTISWOODE PARK ROAD,SPOTTISWOODE 18,18,SPOTTISWOODE PARK ROAD,SPOTTISWOODE 18,18 SPOTTISWOODE PARK ROAD SPOTTISWOODE 18 SINGAPORE 088642,088642,28472.0209475709,28674.3665654343,1.27559528527257,103.837559859708
BALMORAL HEIGHTS BALMORAL CRESCENT,BALMORAL HEIGHTS,8,BALMORAL CRESCENT,BALMORAL HEIGHTS,8 BALMORAL CRESCENT BALMORAL HEIGHTS SINGAPORE 259928,259928,28158.3242604882,33038.4608167782,1.31506262218241,103.834741202363
THE BEACON CANTONMENT ROAD,THE BEACON,130,CANTONMENT ROAD,THE BEACON,130 CANTONMENT ROAD THE BEACON SINGAPORE 089775,089775,28797.1200381396,28705.2784702368,1.27587483521415,103.840480994349
BLISS LOFT KIM KEAT CLOSE,BLISS LOFT,25,KIM KEAT CLOSE,BLISS LOFT,25 KIM KEAT CLOSE BLISS LOFT SINGAPORE 328933,328933,30182.4729403267,33941.5158270076,1.32322945510697,103.852929261304
FARRER PARK SUITES OWEN ROAD,FARRER PARK SUITES,80,OWEN ROAD,FARRER PARK SUITES,80 OWEN ROAD FARRER PARK SUITES SINGAPORE 218896,218896,30260.8459516373,32843.3120476715,1.31329768304541,103.853633404104
PARC ESTA SIMS AVENUE,PARC ESTA,900,SIMS AVENUE,PARC ESTA,900 SIMS AVENUE PARC ESTA SINGAPORE 408966,408966,35802.8436090862,33412.7106635105,1.31844621299537,103.90343113612
THE LINCOLN RESIDENCES SURREY ROAD,THE LINCOLN RESIDENCES,28,SURREY ROAD,THE LINCOLN RESIDENCES,28 SURREY ROAD THE LINCOLN RESIDENCES SINGAPORE 307762,307762,29010.6605421929,33072.9770936184,1.31537475902919,103.842399874258
THE LAURELS CAIRNHILL ROAD,THE LAURELS,38,CAIRNHILL ROAD,THE LAURELS,38 CAIRNHILL ROAD THE LAURELS SINGAPORE 229658,229658,28457.7702057455,31900.8369234893,1.30477434995815,103.83743185829
V ON SHENTON SHENTON WAY,V ON SHENTON,5A,SHENTON WAY,V ON SHENTON,5A SHENTON WAY V ON SHENTON SINGAPORE 068814,068814,29765.3991632639,28838.9204263333,1.27708340707631,103.849181343548
SIMSVILLE GEYLANG EAST AVENUE 2,SIMSVILLE,2,GEYLANG EAST AVENUE 2,SIMSVILLE,2 GEYLANG EAST AVENUE 2 SIMSVILLE SINGAPORE 389754,389754,34363.6909397766,33256.2031223327,1.31703114737635,103.890499582849
ONE BALMORAL BALMORAL ROAD,ONE BALMORAL,1,BALMORAL ROAD,ONE BALMORAL,1 BALMORAL ROAD ONE BALMORAL SINGAPORE 259784,259784,27620.4461175334,32864.3414860591,1.31348794645771,103.829908098471
THE CLEMENT CANOPY CLEMENTI AVENUE 1,THE CLEMENT CANOPY,16,CLEMENTI AVENUE 1,THE CLEMENT CANOPY,16 CLEMENTI AVENUE 1 THE CLEMENT CANOPY SINGAPORE 129960,129960,20783.9668250447,32183.7145376746,1.30733175591803,103.768479099284
ROCHELLE AT NEWTON KENG LEE ROAD,ROCHELLE AT NEWTON,188,KENG LEE ROAD,ROCHELLE AT NEWTON,188 KENG LEE ROAD ROCHELLE AT NEWTON SINGAPORE 308414,308414,28957.5795186115,32925.8568043746,1.31404425678498,103.841922909924
OXLEY EDGE RIVER VALLEY ROAD,OXLEY EDGE,308,RIVER VALLEY ROAD,OXLEY EDGE,308 RIVER VALLEY ROAD OXLEY EDGE SINGAPORE 238349,238349,28923.3288130611,30889.816469362,1.29563102657533,103.841615089993
CITY GATE BEACH ROAD,CITY GATE,371,BEACH ROAD,CITY GATE,371 BEACH ROAD CITY GATE SINGAPORE 199597,199597,31228.8929515947,31629.0129348133,1.30231590504573,103.862331661034
THE ASANA QUEEN'S ROAD,THE ASANA,19,QUEEN'S ROAD,THE ASANA,19 QUEEN'S ROAD THE ASANA SINGAPORE 266745,266745,25523.5313282236,33792.9812662229,1.32188613848343,103.811066200681
VILLAGE TOWER MOUNT SINAI RISE,VILLAGE TOWER,35,MOUNT SINAI RISE,VILLAGE TOWER,35 MOUNT SINAI RISE VILLAGE TOWER SINGAPORE 276955,276955,21821.2533208868,33033.535701273,1.31501745994075,103.777799437784
MARINA ONE RESIDENCES MARINA WAY,MARINA ONE RESIDENCES,21,MARINA WAY,MARINA ONE RESIDENCES,21 MARINA WAY MARINA ONE RESIDENCES SINGAPORE 018978,018978,30226.7704674443,28798.1854408979,1.27671498507474,103.853326932298
E MAISON BRADDELL ROAD,E MAISON,28,BRADDELL ROAD,E MAISON,28 BRADDELL ROAD E MAISON SINGAPORE 359966,359966,31995.1416696385,36158.9400509764,1.34328286670471,103.869217344339
NOVA 88 BHAMO ROAD,NOVA 88,8,BHAMO ROAD,NOVA 88,8 BHAMO ROAD NOVA 88 SINGAPORE 329640,329640,29797.5157338185,34107.0864197463,1.32472684199302,103.849470225477
ST REGIS RESIDENCES SINGAPORE TANGLIN ROAD,SAINT REGIS RESIDENCES SINGAPORE,31,TANGLIN ROAD,SAINT REGIS RESIDENCES SINGAPORE,31 TANGLIN ROAD SAINT REGIS RESIDENCES SINGAPORE SINGAPORE 247912,247912,27161.1942078406,31939.9952799212,1.30512847628769,103.82578151636
PARK COLONIAL WOODLEIGH LANE,PARK COLONIAL,2,WOODLEIGH LANE,PARK COLONIAL,2 WOODLEIGH LANE PARK COLONIAL SINGAPORE 357685,357685,31953.8835021053,35628.1605977062,1.33848269211186,103.86884654561
BURLINGTON SQUARE BENCOOLEN STREET,BURLINGTON SQUARE,175,BENCOOLEN STREET,BURLINGTON SQUARE,175 BENCOOLEN STREET BURLINGTON SQUARE SINGAPORE 189649,189649,30157.000343537,31620.9711250234,1.30224327074302,103.85270021499
EURO-ASIA PARK WOODLEIGH CLOSE,EURO-ASIA PARK,25,WOODLEIGH CLOSE,EURO-ASIA PARK,25 WOODLEIGH CLOSE EURO-ASIA PARK SINGAPORE 357920,357920,31824.8649805225,35395.8168957345,1.33638147508185,103.867687209306
BARTLEY RIDGE MOUNT VERNON ROAD,BARTLEY RIDGE,30,MOUNT VERNON ROAD,BARTLEY RIDGE,30 MOUNT VERNON ROAD BARTLEY RIDGE SINGAPORE 368055,368055,33257.3192844996,35872.1925540008,1.34068943096191,103.880558721941
THE POIZ RESIDENCES MEYAPPA CHETTIAR ROAD,THE POIZ RESIDENCES,2,MEYAPPA CHETTIAR ROAD,THE POIZ RESIDENCES,2 MEYAPPA CHETTIAR ROAD THE POIZ RESIDENCES SINGAPORE 358472,358472,31933.0762609867,34914.3555805776,1.33202729656296,103.868659488195
