QUERY,SEARCHVAL,BLK_NO,ROAD_NAME,BUILDING,ADDRESS,POSTAL,X,Y,LATITUDE,LONGITUDE
POSHGROVE EAST EAST COAST ROAD,POSHGROVE EAST,329,EAST COAST ROAD,POSHGROVE EAST,329 EAST COAST ROAD POSHGROVE EAST SINGAPORE 429099,429099,36476.2435618015,32340.6714070719,1.30875089812796,103.909481683586
LOYANG GARDENS JALAN LOYANG BESAR,LOYANG GARDENS,49,JALAN LOYANG BESAR,LOYANG GARDENS,49 JALAN LOYANG BESAR LOYANG GARDENS SINGAPORE 509373,509373,41730.0877441633,39981.9683353193,1.3778540231339,103.956693393734
UNITED MANSION EAST COAST ROAD,UNITED MANSIONS,614,EAST COAST ROAD,UNITED MANSIONS,614 EAST COAST ROAD UNITED MANSIONS SINGAPORE 459007,459007,37840.1902497401,32617.2831854112,1.31125206992852,103.921737475803
MOUNTBATTEN SUITES MOUNTBATTEN ROAD,MOUNTBATTEN SUITES,861,MOUNTBATTEN ROAD,MOUNTBATTEN SUITES,861 MOUNTBATTEN ROAD MOUNTBATTEN SUITES SINGAPORE 437842,437842,35415.6243853513,31733.5850047916,1.30326089932611,103.89995137284
1 KING ALBERT PARK KING ALBERT PARK,1 KING ALBERT PARK,1,KING ALBERT PARK,1 KING ALBERT PARK,1 KING ALBERT PARK 1 KING ALBERT PARK SINGAPORE 598326,598326,22099.2876036577,35417.0889622793,1.33657351759693,103.780297255982
WOODGROVE CONDOMINIUM WOODGROVE DRIVE,WOODGROVE CONDOMINIUM,2,WOODGROVE DRIVE,WOODGROVE CONDOMINIUM,2 WOODGROVE DRIVE WOODGROVE CONDOMINIUM SINGAPORE 738207,738207,22330.1167865265,45637.6530238986,1.4290046460223,103.7823694182
D' FRESCO JOO CHIAT LANE,D' FRESCO,58,JOO CHIAT LANE,D' FRESCO,58 JOO CHIAT LANE D' FRESCO SINGAPORE 428109,428109,35845.2726027658,32736.1952574998,1.31232804035988,103.903812210573
WORTHINGTON BUTTERWORTH LANE,WORTHINGTON,35,BUTTERWORTH LANE,WORTHINGTON,35 BUTTERWORTH LANE WORTHINGTON SINGAPORE 439443,439443,34965.9075261578,32791.6519545857,1.31282978234139,103.895910698856
THE EDGEWATER JALAN LOYANG BESAR,THE EDGEWATER,211,JALAN LOYANG BESAR,THE EDGEWATER,211 JALAN LOYANG BESAR THE EDGEWATER SINGAPORE 509504,509504,42618.2833234128,40251.4639290795,1.38029080909587,103.964674596342
THE CARPMAELINA CARPMAEL ROAD,THE CARPMAELINA,48,CARPMAEL ROAD,THE CARPMAELINA,48 CARPMAEL ROAD THE CARPMAELINA SINGAPORE 429974,429974,35196.9247942772,32762.3587815519,1.31256481224506,103.897986495436
THE AMSTON HILLVIEW AVENUE,THE AMSTON,130,HILLVIEW AVENUE,THE AMSTON,130 HILLVIEW AVENUE THE AMSTON SINGAPORE 669596,669596,19892.1212296383,37656.097830262,1.35682179002634,103.760463994003
PEAKVIEW ESTATE JALAN PARI KIKIS,PEAKVIEW ESTATE,1,JALAN PARI KIKIS,PEAKVIEW ESTATE,1 JALAN PARI KIKIS PEAKVIEW ESTATE SINGAPORE 488527,488527,40192.465877898,34832.5554768108,1.33128533163241,103.942874670779
NIM GARDENS NIM ROAD,NIM GARDENS,71,NIM ROAD,NIM GARDENS,71 NIM ROAD NIM GARDENS SINGAPORE 807583,807583,31307.9667878011,40377.3102751654,1.38143238111123,103.863043130131
UNI BUILDING TELOK KURAU ROAD,UNI BUILDING,224,TELOK KURAU ROAD,UNI BUILDING,224 TELOK KURAU ROAD UNI BUILDING SINGAPORE 423836,423836,36621.5541585675,32640.6339360066,1.31146361071392,103.910787451343
TRESALVEO MARYMOUNT TERRACE,TRESALVEO,7,MARYMOUNT TERRACE,TRESALVEO,7 MARYMOUNT TERRACE TRESALVEO SINGAPORE 573963,573963,28835.1016661674,37016.9434072711,1.35104259761342,103.840822496926
PRESIDIO CEYLON LANE,PRESIDIO,5,CEYLON LANE,PRESIDIO,5 CEYLON LANE PRESIDIO SINGAPORE 423472,423472,35381.3040937064,32564.4282334019,1.31077475575451,103.89964318646
FLORAVIEW ANG MO KIO STREET 66,FLORAVIEW,1,ANG MO KIO STREET 66,FLORAVIEW,1 ANG MO KIO STREET 66 FLORAVIEW SINGAPORE 567705,567705,29907.0561722508,41489.6677269023,1.39149226761388,103.850454975085
YIKAI COURT UPPER PAYA LEBAR ROAD,YIKAI COURT,371,UPPER PAYA LEBAR ROAD,YIKAI COURT,371 UPPER PAYA LEBAR ROAD YIKAI COURT SINGAPORE 534969,534969,33192.6172015183,36691.7510005087,1.34810123517193,103.879977476003
SUNSHINE MANSIONS JOO CHIAT PLACE,SUNSHINE MANSIONS,289,JOO CHIAT PLACE,SUNSHINE MANSIONS,289 JOO CHIAT PLACE SUNSHINE MANSIONS SINGAPORE 427970,427970,36288.1925743399,33019.6026522033,1.31489095859612,103.907792137947
LIGHTHOUSE JALAN LOYANG BESAR,LIGHTHOUSE,161,JALAN LOYANG BESAR,LIGHTHOUSE,161 JALAN LOYANG BESAR LIGHTHOUSE SINGAPORE 509408,509408,42001.8740491997,40030.6116184667,1.37829380600619,103.959135610337
MALVERN SPRINGS ONAN ROAD,MALVERN SPRINGS,373,ONAN ROAD,MALVERN SPRINGS,373 ONAN ROAD MALVERN SPRINGS SINGAPORE 424775,424775,35855.1914815661,32022.6254528724,1.3058747690711,103.903901156114
ROXY SQUARE EAST COAST ROAD,ROXY SQUARE,50,EAST COAST ROAD,ROXY SQUARE,50 EAST COAST ROAD ROXY SQUARE SINGAPORE 428769,428769,35871.8859393252,31851.3707749359,1.30432599904899,103.904051120306
RESIDENCE 118 LORONG L TELOK KURAU,RESIDENCE 118,118,LORONG L TELOK KURAU,RESIDENCE 118,118 LORONG L TELOK KURAU RESIDENCE 118 SINGAPORE 425552,425552,36988.7387314681,32708.6240300592,1.31207838359164,103.914086801504
IVORY CEYLON LANE,IVORY,15,CEYLON LANE,IVORY,15 CEYLON LANE IVORY SINGAPORE 423468,423468,35466.7273356607,32633.7852901351,1.3114019755049,103.900410772179
THE BECCAGAYLE LORONG N TELOK KURAU,THE BECCAGAYLE,15,LORONG N TELOK KURAU,THE BECCAGAYLE,15 LORONG N TELOK KURAU THE BECCAGAYLE SINGAPORE 425142,425142,36471.9583720071,32438.9348725434,1.30963955864522,103.909443205926
CRESCENDO BUILDING UPPER EAST COAST ROAD,CRESCENDO BUILDING,17,UPPER EAST COAST ROAD,CRESCENDO BUILDING,17 UPPER EAST COAST ROAD CRESCENDO BUILDING SINGAPORE 455208,455208,38350.8129813978,32824.4227373414,1.31312519718196,103.926325734684
EAST GALLERIA SEA AVENUE,EAST GALLERIA,19,SEA AVENUE,EAST GALLERIA,19 SEA AVENUE EAST GALLERIA SINGAPORE 424239,424239,36231.7496555401,32014.354726322,1.3057998737184,103.907284703752
EASTSIDE LOFT TANJONG KATONG ROAD,EASTSIDE LOFT,150,TANJONG KATONG ROAD,EASTSIDE LOFT,150 TANJONG KATONG ROAD EASTSIDE LOFT SINGAPORE 437154,437154,34734.3415297605,32555.6160126217,1.31069520929113,103.893829913531
EBONY MANSIONS LORONG M TELOK KURAU,EBONY MANSIONS,30,LORONG M TELOK KURAU,EBONY MANSIONS,30 LORONG M TELOK KURAU EBONY MANSIONS SINGAPORE 425312,425312,36578.613181944,32492.8375205416,1.31012700527051,103.910401565081
LIVINGSTON MANSIONS LORONG L TELOK KURAU,LIVINGSTON MANSIONS,135,LORONG L TELOK KURAU,LIVINGSTON MANSIONS,135 LORONG L TELOK KURAU LIVINGSTON MANSIONS SINGAPORE 425571,425571,37090.6271512052,32805.6846155897,1.31295613447289,103.915002346739
CALLIDORA VILLE LORONG N TELOK KURAU,CALLIDORA VILLE,19,LORONG N TELOK KURAU,CALLIDORA VILLE,19 LORONG N TELOK KURAU CALLIDORA VILLE SINGAPORE 425145,425145,36501.4317000797,32448.1861606948,1.30972321585123,103.90970804035
SERAYA VILLE SERAYA LANE,SERAYA VILLE,11,SERAYA LANE,SERAYA VILLE,11 SERAYA LANE SERAYA VILLE SINGAPORE 437278,437278,35420.8842950258,32203.583804246,1.30751139870451,103.899998747467
VERSAILLES HEMMANT ROAD,VERSAILLES,133,HEMMANT ROAD,VERSAILLES,133 HEMMANT ROAD VERSAILLES SINGAPORE 438686,438686,34366.409458735,32664.2157523893,1.31167742470116,103.890523888329
CHERRY GARDENS LORONG LEW LIAN,CHERRY GARDENS,61,LORONG LEW LIAN,CHERRY GARDENS,61 LORONG LEW LIAN CHERRY GARDENS SINGAPORE 536491,536491,33053.3776055863,36904.8882442154,1.35002879580504,103.878726357571
PROSPERO VILLE LORONG K TELOK KURAU,PROSPERO VILLE,127,LORONG K TELOK KURAU,PROSPERO VILLE,127 LORONG K TELOK KURAU PROSPERO VILLE SINGAPORE 425766,425766,37028.6668632608,32919.3237325009,1.3139838637399,103.91444563651
CASA ESPERANZA BUKIT TIMAH ROAD,CASA ESPERANZA,995,BUKIT TIMAH ROAD,CASA ESPERANZA,995 BUKIT TIMAH ROAD CASA ESPERANZA SINGAPORE 589632,589632,22450.3867408987,35233.0162472576,1.33490889638351,103.78345211809
PALMERA RESIDENCE LORONG N TELOK KURAU,PALMERA RESIDENCE,38,LORONG N TELOK KURAU,PALMERA RESIDENCE,38 LORONG N TELOK KURAU PALMERA RESIDENCE SINGAPORE 425163,425163,36677.4096666081,32424.1115815379,1.30950544505901,103.911289279494
ST PATRICK'S LOFT ST. PATRICK'S ROAD,SAINT PATRICK'S LOFT,41,SAINT PATRICK'S ROAD,SAINT PATRICK'S LOFT,41 SAINT PATRICK'S ROAD SAINT PATRICK'S LOFT SINGAPORE 424164,424164,36898.1356991921,32320.0973505005,1.30856471509519,103.913272578012
ROSE VILLE ROSE LANE,ROSE VILLE,2,ROSE LANE,ROSE VILLE,2 ROSE LANE ROSE VILLE SINGAPORE 437384,437384,34733.6576246684,32532.5358880702,1.31048648105236,103.893823763306
THE WOODGROVE WOODGROVE DRIVE,THE WOODGROVE,3,WOODGROVE DRIVE,THE WOODGROVE,3 WOODGROVE DRIVE THE WOODGROVE SINGAPORE 738230,738230,22232.8167812452,45614.914322203,1.42879898582682,103.781495092242
NYON AMBER ROAD,NYON,12,AMBER ROAD,NYON,12 AMBER ROAD NYON SINGAPORE 439858,439858,35253.3036660245,31351.8192544859,1.29980838493639,103.898492758597
BOON COURT STILL ROAD,BOON COURT,155,STILL ROAD,BOON COURT,155 STILL ROAD BOON COURT SINGAPORE 423992,423992,36028.9743836466,33073.2927281521,1.31537658111476,103.905462947954
CUBIK LORONG K TELOK KURAU,CUBIK,81,LORONG K TELOK KURAU,CUBIK,81 LORONG K TELOK KURAU CUBIK SINGAPORE 425711,425711,36757.8860606439,32858.9663764387,1.31343809193913,103.91201252096
BEAUTY WORLD PLAZA UPPER BUKIT TIMAH ROAD,BEAUTY WORLD PLAZA,140,UPPER BUKIT TIMAH ROAD,BEAUTY WORLD PLAZA,140 UPPER BUKIT TIMAH ROAD BEAUTY WORLD PLAZA SINGAPORE 588176,588176,21649.9257879127,35995.0375873558,1.34180018619223,103.776259359854
SUN PLAZA SEMBAWANG DRIVE,SUN PLAZA,30,SEMBAWANG DRIVE,SUN PLAZA,30 SEMBAWANG DRIVE SUN PLAZA SINGAPORE 757713,757713,26462.4476639526,47759.6068513971,1.44819535371132,103.819502127155
CHERRYHILL LORONG LEW LIAN,CHERRYHILL,21,LORONG LEW LIAN,CHERRYHILL,21 LORONG LEW LIAN CHERRYHILL SINGAPORE 536467,536467,32943.9773987224,36955.3042929024,1.35048475874826,103.877743336325
DAWN VILLE BUTTERWORTH LANE,DAWN VILLE,1,BUTTERWORTH LANE,DAWN VILLE,1 BUTTERWORTH LANE DAWN VILLE SINGAPORE 439444,439444,34818.0134359095,32758.6455053091,1.3125313169466,103.89458179066
RESIDENTIAL APARTMENTS FLOWER ROAD,,,,,,,,,,
SHIRO LORONG H TELOK KURAU,SHIRO,38,LORONG H TELOK KURAU,SHIRO,38 LORONG H TELOK KURAU SHIRO SINGAPORE 426025,426025,36309.8147506528,33077.3429778591,1.31541313542995,103.907986439428
SEA PAVILION RESIDENCES UPPER EAST COAST ROAD,SEA PAVILION RESIDENCES,494,UPPER EAST COAST ROAD,SEA PAVILION RESIDENCES,494 UPPER EAST COAST ROAD SEA PAVILION RESIDENCES SINGAPORE 466522,466522,40221.9609383829,33040.1845481843,1.31507578093932,103.943138987244
BELLEZZA @ KATONG CEYLON ROAD,BELLEZZA @ KATONG,46,CEYLON ROAD,BELLEZZA @ KATONG,46 CEYLON ROAD BELLEZZA @ KATONG SINGAPORE 429634,429634,35652.1437070156,32136.6459161118,1.3069059800853,103.902076705616
BERKELEY RESIDENCES LORONG N TELOK KURAU,BERKELEY RESIDENCES,11,LORONG N TELOK KURAU,BERKELEY RESIDENCES,11 LORONG N TELOK KURAU BERKELEY RESIDENCES SINGAPORE 425141,425141,36451.365519017,32436.6628063452,1.30961901654531,103.909258168713
ARTHUR MANSIONS ARTHUR ROAD,CHNG MANSIONS,120,ARTHUR ROAD,CHNG MANSIONS,120 ARTHUR ROAD CHNG MANSIONS SINGAPORE 439828,439828,34072.6041641198,31217.2104481868,1.29859128385275,103.88788362263
SEASIDE PARK JALAN SAUDARA KU,SEASIDE PARK,1,JALAN SAUDARA KU,SEASIDE PARK,1 JALAN SAUDARA KU SEASIDE PARK SINGAPORE 457438,457438,37681.5759660909,32566.6817755941,1.31079449939917,103.920312234618
THE HILLSIDE UPPER BUKIT TIMAH ROAD,THE HILLSIDE,341,UPPER BUKIT TIMAH ROAD,THE HILLSIDE,341 UPPER BUKIT TIMAH ROAD THE HILLSIDE SINGAPORE 588195,588195,20743.5725663025,37145.6310695242,1.35220553308391,103.768114960124
BALCON EAST UPPER EAST COAST ROAD,BALCON EAST,482,UPPER EAST COAST ROAD,BALCON EAST,482 UPPER EAST COAST ROAD BALCON EAST SINGAPORE 466519,466519,40128.853200186,33003.4127920009,1.31474326765884,103.942302354429
8 EDEN GROVE EDEN GROVE,8 EDEN GROVE SINGAPORE 539060,8,EDEN GROVE,NIL,8 EDEN GROVE SINGAPORE 539060,539060,32340.3048920566,36323.717410665,1.34477300646021,103.872318867919
TEMBELING RESIDENCE TEMBELING ROAD,TEMBELING RESIDENCE,246,TEMBELING ROAD,TEMBELING RESIDENCE,246 TEMBELING ROAD TEMBELING RESIDENCE SINGAPORE 423725,423725,35955.4741544984,32184.5994221792,1.307339577796,103.904802283858
MERLOT VILLE TELOK KURAU ROAD,MERLOT VILLE,281,TELOK KURAU ROAD,MERLOT VILLE,281 TELOK KURAU ROAD MERLOT VILLE SINGAPORE 423847,423847,36752.6365328878,32535.0251875874,1.31050848639697,103.911965259921
EURO-ASIA LODGE JOO CHIAT TERRACE,EURO-ASIA LODGE,96,JOO CHIAT TERRACE,EURO-ASIA LODGE,96 JOO CHIAT TERRACE EURO-ASIA LODGE SINGAPORE 427253,427253,35644.6450561937,32956.2041507456,1.31431777216437,103.90200952862
THOMSON V ONE SIN MING ROAD,THOMSON V ONE,9,SIN MING ROAD,THOMSON V ONE,9 SIN MING ROAD THOMSON V ONE SINGAPORE 575630,575630,28249.9711144511,37254.938747162,1.35319495337208,103.835564729862
LE WOOD HINDHEDE DRIVE,LE WOOD,21,HINDHEDE DRIVE,LE WOOD,21 HINDHEDE DRIVE LE WOOD SINGAPORE 589318,589318,21596.8865644168,36580.4841973577,1.34709474344486,103.775782646855
THE OLD HOUSE UPPER SERANGOON ROAD,THE OLD HOUSE,1011,UPPER SERANGOON ROAD,THE OLD HOUSE,1011 UPPER SERANGOON ROAD THE OLD HOUSE SINGAPORE 534749,534749,34021.7314623622,38305.451746529,1.36269480854643,103.887427905362
SIGNATURE CREST GRAY LANE,SIGNATURE CREST,9,GRAY LANE,SIGNATURE CREST,9 GRAY LANE SIGNATURE CREST SINGAPORE 438951,438951,34657.5303161414,32728.5337043889,1.31225903171368,103.893139764788
HIGHLAND CONDOMINIUM HIGHLAND ROAD,HIGHLAND CONDOMINIUM,101,HIGHLAND ROAD,HIGHLAND CONDOMINIUM,101 HIGHLAND ROAD HIGHLAND CONDOMINIUM SINGAPORE 549176,549176,33193.5868061082,37943.9176916312,1.35942538111065,103.879986404947
FAIRMOUNT CONDOMINIUM EASTWOOD ROAD,FAIRMOUNT CONDOMINIUM,30,EASTWOOD ROAD,FAIRMOUNT CONDOMINIUM,30 EASTWOOD ROAD FAIRMOUNT CONDOMINIUM SINGAPORE 486365,486365,41640.1196131138,33694.0412205122,1.32098841923667,103.95588211997
SUITES AT BUKIT TIMAH JALAN JURONG KECHIL,SUITES AT BUKIT TIMAH,68,JALAN JURONG KECHIL,SUITES AT BUKIT TIMAH,68 JALAN JURONG KECHIL SUITES AT BUKIT TIMAH SINGAPORE 596180,596180,21359.4319015201,35856.6370502003,1.34054847886549,103.773649129593
JC RESIDENCE JOO CHIAT LANE,JC RESIDENCE,3,JOO CHIAT LANE,JC RESIDENCE,3 JOO CHIAT LANE JC RESIDENCE SINGAPORE 428129,428129,35485.6722180089,32771.6481468268,1.31264875307626,103.900581034415
ENG KONG GREEN ENG KONG CRESCENT,ENG KONG GREEN,33,ENG KONG CRESCENT,ENG KONG GREEN,33 ENG KONG CRESCENT ENG KONG GREEN SINGAPORE 599426,599426,20874.3298322093,35348.8036948498,1.33595570623066,103.769290320199
SUNNYVALE RESIDENCES LORONG K TELOK KURAU,SUNNYVALE RESIDENCES,132,LORONG K TELOK KURAU,SUNNYVALE RESIDENCES,132 LORONG K TELOK KURAU SUNNYVALE RESIDENCES SINGAPORE 425790,425790,37124.9944792967,32850.3728721086,1.31336026870657,103.915311167083
EIS RESIDENCES HAIG AVENUE,EIS RESIDENCES,4,HAIG AVENUE,EIS RESIDENCES,4 HAIG AVENUE EIS RESIDENCES SINGAPORE 438859,438859,35364.2642177166,32219.2476674281,1.30765307060931,103.89948999313
AXIS @ SIGLAP EAST COAST TERRACE,AXIS @ SIGLAP,59,EAST COAST TERRACE,AXIS @ SIGLAP,59 EAST COAST TERRACE AXIS @ SIGLAP SINGAPORE 458950,458950,38072.6571726725,32684.9650000501,1.31186408450582,103.923826324456
STRAITS RESIDENCES JOO CHIAT PLACE,STRAITS RESIDENCES,156,JOO CHIAT PLACE,STRAITS RESIDENCES,156 JOO CHIAT PLACE STRAITS RESIDENCES SINGAPORE 427884,427884,35923.7066343315,32871.9554276299,1.31355578639069,103.904517013271
FREESIA WOODS SUNSET WAY,FREESIA WOODS,61,SUNSET WAY,FREESIA WOODS,61 SUNSET WAY FREESIA WOODS SINGAPORE 597086,597086,20605.8710379638,34006.8880128805,1.32381983979324,103.766878388655
CHOON KIM HOUSE UPPER SERANGOON ROAD,,,,,,,,,,
ESPIRA RESIDENCE LORONG K TELOK KURAU,ESPIRA RESIDENCE,80,LORONG K TELOK KURAU,ESPIRA RESIDENCE,80 LORONG K TELOK KURAU ESPIRA RESIDENCE SINGAPORE 425710,425710,36793.8464229871,32798.8927221876,1.31289479727385,103.912335625355
GRAND CHATEAU JALAN RAJAWALI,GRAND CHATEAU,2,JALAN RAJAWALI,GRAND CHATEAU,2 JALAN RAJAWALI GRAND CHATEAU SINGAPORE 598435,598435,20796.4007008793,36222.9203636181,1.34386088362378,103.768589874738
ROYALE MANSIONS PULASAN ROAD,ROYALE MANSIONS,5,PULASAN ROAD,ROYALE MANSIONS,5 PULASAN ROAD ROYALE MANSIONS SINGAPORE 424373,424373,36130.6952398261,32725.4059622921,1.31223039181849,103.906376869088
CANNAVILLE DUKU ROAD,CANNAVILLE,34,DUKU ROAD,CANNAVILLE,34 DUKU ROAD CANNAVILLE SINGAPORE 429192,429192,36026.0567316245,32380.6777513344,1.30911282141402,103.905436552041
MEYER PARK MEYER ROAD,KATONG PARK MRT STATION (TE24),45,MEYER ROAD,KATONG PARK MRT STATION (TE24),45 MEYER ROAD KATONG PARK MRT STATION (TE24) SINGAPORE 437870,437870,33882.890949796,31133.1909445133,1.29783147778951,103.886178949925
EASTCOVE RESIDENCES JOO CHIAT PLACE,EASTCOVE RESIDENCES,302,JOO CHIAT PLACE,EASTCOVE RESIDENCES,302 JOO CHIAT PLACE EASTCOVE RESIDENCES SINGAPORE 427982,427982,36405.8627510555,32969.7253433596,1.31443985425782,103.908849449218
KOVANA KOVAN ROAD,KOVANA,53,KOVAN ROAD,KOVANA,53 KOVAN ROAD KOVANA SINGAPORE 548136,548136,33282.1118807662,37737.1360888779,1.35755530701427,103.880781824863
EAST VIEW 18 RAMBUTAN ROAD,EAST VIEW 18,18,RAMBUTAN ROAD,EAST VIEW 18,18 RAMBUTAN ROAD EAST VIEW 18 SINGAPORE 424302,424302,35961.0167671405,32841.6546334196,1.31328174728474,103.904852255354
EVERITT EDGE JOO CHIAT PLACE,EVERITT EDGE,83,JOO CHIAT PLACE,EVERITT EDGE,83 JOO CHIAT PLACE EVERITT EDGE SINGAPORE 427800,427800,35617.1963232839,32894.596605882,1.31376062248786,103.901762873018
THE MONTAGE LORONG M TELOK KURAU,THE MONTAGE,50,LORONG M TELOK KURAU,THE MONTAGE,50 LORONG M TELOK KURAU THE MONTAGE SINGAPORE 425342,425342,36786.4285574136,32550.1213141978,1.31064500070004,103.912268901718
JOO CHIAT MANSIONS JOO CHIAT PLACE,JOO CHIAT MANSIONS,185,JOO CHIAT PLACE,JOO CHIAT MANSIONS,185 JOO CHIAT PLACE JOO CHIAT MANSIONS SINGAPORE 427897,427897,35906.7486635065,32936.9502928182,1.31414358091839,103.904364654172
THE BAYCOURT UPPER EAST COAST ROAD,THE BAYCOURT,461A,UPPER EAST COAST ROAD,THE BAYCOURT,461A UPPER EAST COAST ROAD THE BAYCOURT SINGAPORE 466507,466507,40031.1530824285,33118.2090539299,1.31578148106134,103.941424516025
MONDO MANSION BUILDING UPPER SERANGOON ROAD,MONDO MANSION BUILDING,543A,UPPER SERANGOON ROAD,MONDO MANSION BUILDING,543A UPPER SERANGOON ROAD MONDO MANSION BUILDING SINGAPORE 534553,534553,32238.3754894696,36529.3250091355,1.34663246265908,103.871402998981
WATERCREST LOYANG BESAR CLOSE,WATERCREST,123,LOYANG BESAR CLOSE,WATERCREST,123 LOYANG BESAR CLOSE WATERCREST SINGAPORE 509027,509027,41806.5905572968,39971.8761723116,1.37776271751871,103.957380821299
KILAT COURT LORONG KILAT,KILAT COURT,17,LORONG KILAT,KILAT COURT,17 LORONG KILAT KILAT COURT SINGAPORE 598139,598139,21422.4834108138,35887.5107265394,1.34082770311651,103.774215677961
SUNSHINE GRANDEUR LORONG K TELOK KURAU,SUNSHINE GRANDEUR,63,LORONG K TELOK KURAU,SUNSHINE GRANDEUR,63 LORONG K TELOK KURAU SUNSHINE GRANDEUR SINGAPORE 425673,425673,36539.9241306009,32815.9413153548,1.31304905009595,103.910054014447
BINJAI PARK BINJAI PARK,BINJAI PARK (ROAD),,BINJAI PARK (ROAD),NIL,BINJAI PARK (ROAD),NIL,22926.965811471,35708.8694070667,1.33921171778687,103.787734586051
IDYLLIC EAST UPPER EAST COAST ROAD,IDYLLIC EAST,576,UPPER EAST COAST ROAD,IDYLLIC EAST,576 UPPER EAST COAST ROAD IDYLLIC EAST SINGAPORE 466588,466588,40552.9230887368,33152.1039896011,1.3160878054443,103.946112888683
RESIDENCES @ JANSEN JANSEN ROAD,MINT RESIDENCES @ JANSEN,20,JANSEN ROAD,MINT RESIDENCES @ JANSEN,20 JANSEN ROAD MINT RESIDENCES @ JANSEN SINGAPORE 548411,548411,32908.3196254121,37992.7838076763,1.35986735718564,103.877423098448
STILL MANSIONS STILL ROAD,STILL MANSIONS,2,STILL ROAD,STILL MANSIONS,2 STILL ROAD STILL MANSIONS SINGAPORE 423950,423950,36408.8054649681,32317.7946228348,1.30854402717824,103.908875714181
BAGNALL COURT UPPER EAST COAST ROAD,,,,,,,,,,
MADEIRA COURT LORONG M TELOK KURAU,MADEIRA COURT,18,LORONG M TELOK KURAU,MADEIRA COURT,18 LORONG M TELOK KURAU MADEIRA COURT SINGAPORE 425408,425408,36511.0547396066,32494.9884542692,1.31014647625515,103.909794520776
MAYA STILL ROAD,MAYA,9,STILL ROAD,MAYA,9 STILL ROAD MAYA SINGAPORE 423953,423953,36290.8410834512,32395.7242989875,1.30924882698649,103.907815769246
TAIPAN REGENCY HAIG ROAD,TAIPAN REGENCY,161,HAIG ROAD,TAIPAN REGENCY,161 HAIG ROAD TAIPAN REGENCY SINGAPORE 438772,438772,35318.9607341597,32164.5785432775,1.3071586734121,103.899082907118
SERAYA COURT SERAYA LANE,SERAYA COURT,10,SERAYA LANE,SERAYA COURT,10 SERAYA LANE SERAYA COURT SINGAPORE 437277,437277,35397.3328071637,32092.6427754033,1.30650809346919,103.899787099891
BREEZE BY THE EAST UPPER EAST COAST ROAD,BREEZE BY THE EAST,316,UPPER EAST COAST ROAD,BREEZE BY THE EAST,316 UPPER EAST COAST ROAD BREEZE BY THE EAST SINGAPORE 465520,465520,39621.3846648438,32936.4165471941,1.31413757436291,103.937742477406
GOODWILL COURT UPPER EAST COAST ROAD,GOODWILL COURT,79A,UPPER EAST COAST ROAD,GOODWILL COURT,79A UPPER EAST COAST ROAD GOODWILL COURT SINGAPORE 455219,455219,38489.1805869872,32850.6208879668,1.31336207683403,103.92756904356
MELROSE VILLE ROSE LANE,MELROSE VILLE,10,ROSE LANE,MELROSE VILLE,10 ROSE LANE MELROSE VILLE SINGAPORE 437370,437370,34671.337632006,32545.3494757619,1.31060237610127,103.893263790865
DE CENTURION TANJONG RHU ROAD,,,,,,,,,,
PARK COURT LORONG 101 CHANGI,PARK COURT,9,LORONG 101 CHANGI,PARK COURT,9 LORONG 101 CHANGI PARK COURT SINGAPORE 426641,426641,35442.6106840065,33097.5534554105,1.31559613406501,103.900194183852
VERANDA LORONG K TELOK KURAU,VERANDA,50,LORONG K TELOK KURAU,VERANDA,50 LORONG K TELOK KURAU VERANDA SINGAPORE 425666,425666,36528.3630926115,32737.0815948658,1.31233587446047,103.909950111168
H RESIDENCES LORONG H TELOK KURAU,H RESIDENCES,50A,LORONG H TELOK KURAU,H RESIDENCES,50A LORONG H TELOK KURAU H RESIDENCES SINGAPORE 426049,426049,36409.5591680305,33109.9839109629,1.31570830110214,103.908882701488
MANDARIN PARK CHUN TIN ROAD,MANDARIN PARK,100,CHUN TIN ROAD,MANDARIN PARK,100 CHUN TIN ROAD MANDARIN PARK SINGAPORE 599676,599676,21153.5791626507,36341.2791369613,1.34493136118736,103.771799311552
CAMELODGE UPPER EAST COAST ROAD,CAMELODGE,106,UPPER EAST COAST ROAD,CAMELODGE,106 UPPER EAST COAST ROAD CAMELODGE SINGAPORE 455296,455296,38682.4974166481,32829.3369261064,1.31316952595243,103.92930608172
RESIDENTIAL APARTMENTS BOUNDARY ROAD,,,,,,,,,,
RESIDENTIAL APARTMENTS EAST COAST ROAD,,,,,,,,,,
SEAVIEW POINT AMBER ROAD,SEAVIEW POINT,15,AMBER ROAD,SEAVIEW POINT,15 AMBER ROAD SEAVIEW POINT SINGAPORE 439865,439865,35400.7329611145,31321.1384154707,1.29953088366934,103.899817468941
ESTERINA HAIG AVENUE,ESTERINA,12,HAIG AVENUE,ESTERINA,12 HAIG AVENUE ESTERINA SINGAPORE 438867,438867,35407.7492613485,32231.8818870466,1.30776731956689,103.899880729747
THE BROOKS II SPRINGSIDE GREEN,THE BROOKS II,25,SPRINGSIDE GREEN,THE BROOKS II,25 SPRINGSIDE GREEN THE BROOKS II SINGAPORE 786015,786015,26389.8407640755,42865.9172303062,1.40393859107231,103.818849957935
THE TAIPAN JALAN HAJIJAH,THE TAIPAN,25,JALAN HAJIJAH,THE TAIPAN,25 JALAN HAJIJAH THE TAIPAN SINGAPORE 468721,468721,39308.153348011,32734.0453528836,1.31230752039196,103.934927867972
GRAND REGALIA UPPER SERANGOON ROAD,GRAND REGALIA,815,UPPER SERANGOON ROAD,GRAND REGALIA,815 UPPER SERANGOON ROAD GRAND REGALIA SINGAPORE 534676,534676,33316.4473064039,37683.7844089866,1.35707280748098,103.881090341686
VENEZIO UPPER EAST COAST ROAD,VENEZIO,488,UPPER EAST COAST ROAD,VENEZIO,488 UPPER EAST COAST ROAD VENEZIO SINGAPORE 466520,466520,40160.9076608382,33011.0489502735,1.3148123135852,103.942590382344
PARRY COURT PARRY AVENUE,PARRY COURT,35,PARRY AVENUE,PARRY COURT,35 PARRY AVENUE PARRY COURT SINGAPORE 547261,547261,33260.4311056379,38445.731138505,1.36396358971437,103.880587133601
ONE ROSYTH ROSYTH ROAD,ONE ROSYTH,1,ROSYTH ROAD,ONE ROSYTH,1 ROSYTH ROAD ONE ROSYTH SINGAPORE 546133,546133,32521.2824938679,38346.8321664482,1.36306930491581,103.873945366339
THE AMERY LORONG K TELOK KURAU,THE AMERY,16,LORONG K TELOK KURAU,THE AMERY,16 LORONG K TELOK KURAU THE AMERY SINGAPORE 425612,425612,36332.7232254688,32699.2052691542,1.31199338819405,103.908192181689
HAIG ELEVEN HAIG AVENUE,HAIG ELEVEN,11,HAIG AVENUE,HAIG ELEVEN,11 HAIG AVENUE HAIG ELEVEN SINGAPORE 438866,438866,35368.0582792079,32309.5961156935,1.30847014866947,103.89952410597
CELADON VIEW JALAN LOYANG BESAR,CELADON VIEW,45,JALAN LOYANG BESAR,CELADON VIEW,45 JALAN LOYANG BESAR CELADON VIEW SINGAPORE 507029,507029,41718.7288963059,40036.7946713772,1.37834985706372,103.95659135188
RESIDENTIAL APARTMENTS STANGEE PLACE,,,,,,,,,,
BOWMONT CENTRE SIGLAP DRIVE,BOWMONT CENTRE,20,SIGLAP DRIVE,BOWMONT CENTRE,20 SIGLAP DRIVE BOWMONT CENTRE SINGAPORE 456192,456192,37562.8661446711,33104.2661072314,1.31565625391676,103.919245736107
833 M B RESIDENCES MOUNTBATTEN ROAD,833 M B RESIDENCES,833,MOUNTBATTEN ROAD,833 M B RESIDENCES,833 MOUNTBATTEN ROAD 833 M B RESIDENCES SINGAPORE 437826,437826,35242.7476461669,31664.1297587194,1.30263281181216,103.898397980442
HERITAGE RESIDENCES LORONG L TELOK KURAU,HERITAGE RESIDENCES,101,LORONG L TELOK KURAU,HERITAGE RESIDENCES,101 LORONG L TELOK KURAU HERITAGE RESIDENCES SINGAPORE 425537,425537,36862.8341497825,32761.6104359236,1.31255760997324,103.912955503031
THE FLORENTINE FLORENCE ROAD,THE FLORENTINE,68,FLORENCE ROAD,THE FLORENTINE,68 FLORENCE ROAD THE FLORENTINE SINGAPORE 549555,549555,33842.2353875507,38710.56503902,1.36635854300553,103.885815091695
DUNMAN REGENCY DUNMAN ROAD,DUNMAN REGENCY,485,DUNMAN ROAD,DUNMAN REGENCY,485 DUNMAN ROAD DUNMAN REGENCY SINGAPORE 439190,439190,34680.7427723184,32435.3665194064,1.30960772754814,103.893348276924
CRESCENDO PARK JALAN TUA KONG,CRESCENDO PARK,6,JALAN TUA KONG,CRESCENDO PARK,6 JALAN TUA KONG CRESCENDO PARK SINGAPORE 457269,457269,38354.3763403166,32853.5777067617,1.31338886288706,103.92635776294
SANTA FE MANSIONS MARGATE ROAD,SANTA FE MANSIONS,2A,MARGATE ROAD,SANTA FE MANSIONS,2A MARGATE ROAD SANTA FE MANSIONS SINGAPORE 438073,438073,34171.050115264,31387.6781585477,1.30013291374093,103.88876823652
SUNNY PARC LORONG K TELOK KURAU,SUNNY PARC,128,LORONG K TELOK KURAU,SUNNY PARC,128 LORONG K TELOK KURAU SUNNY PARC SINGAPORE 425767,425767,37063.2338692416,32851.4526521601,1.31337005210124,103.914756218153
SIMON PLAZA KOVAN ROAD,SIMON PLAZA,2,KOVAN ROAD,SIMON PLAZA,2 KOVAN ROAD SIMON PLAZA SINGAPORE 548008,548008,33750.7346976819,38225.9668105673,1.3619760292092,103.884992801669
